Symbol,Name,Last Sale,Net Change,% Change,Market Cap,Country,IPO Year,Volume,Sector,Industry
RACE,Ferrari N.V. Common Shares,$225.88,2.63,1.178%,55947477443.00,,2015,224275,Capital Goods,Auto Manufacturing
RAD,Rite Aid Corporation Common Stock,$15.19,-0.15,-0.978%,836768674.00,United States,,925899,Health Care,Medical/Nursing Services
RAMP,LiveRamp Holdings Inc. Common Stock,$45.57,-1.45,-3.084%,3095213925.00,United States,2018,389063,Technology,EDP Services
RBA,Ritchie Bros. Auctioneers Incorporated Common Stock,$61.54,0.06,0.098%,6792259402.00,Canada,,699042,Miscellaneous,Business Services
RBAC,RedBall Acquisition Corp. Class A Ordinary Shares,$9.76,0.01,0.103%,701500000.00,United States,2020,66624,Finance,Business Services
RBC,Regal Beloit Corporation Common Stock,$153.86,0.08,0.052%,6261508408.00,United States,,81809,Consumer Durables,Metal Fabrications
RBLX,Roblox Corporation Class A Common Stock,$83.96,1.31,1.585%,47843049633.00,,2021,4211824,Technology,EDP Services
RC,Ready Capital Corproation Common Stock,$15.04,0.13,0.872%,1071321564.00,United States,2013,259899,Consumer Services,Real Estate Investment Trusts
RC^C,Ready Capital Corporation 6.25% Series C Cumulative Convertible Preferred Stock,$25.6937,0.0437,0.17%,,United States,,500,,
RC^E,Ready Capital Corporation 6.50% Series E Cumulative Redeemable Preferred Stock,$25.35,0.00,0.00%,,United States,,4619,,
RCA,Ready Capital Corporation 7.00% Convertible Senior Notes due 2023,$26.77,0.32,1.21%,0.00,United States,2017,795,Consumer Services,Real Estate Investment Trusts
RCB,Ready Capital Corporation 6.20% Senior Notes due 2026,$26.22,-0.12,-0.456%,0.00,United States,2019,3066,,
RCC,Ready Capital Corporation 5.75% Senior Notes due 2026,$25.90,-0.03,-0.116%,,United States,2021,6850,Finance,Finance Companies
RCI,Rogers Communication Inc. Common Stock,$50.84,0.06,0.118%,25670403167.00,Canada,,275589,Consumer Services,Telecom
RCL,D/B/A Royal Caribbean Cruises Ltd. Common Stock,$78.89,-1.45,-1.805%,20092826069.00,United States,1993,2967830,Transportation,Transportation Services
RCS,PIMCO Strategic Income Fund Inc.,$7.93,-0.04,-0.502%,351543847.00,United States,1994,69673,Finance,Investment Managers
RCUS,Arcus Biosciences Inc. Common Stock,$27.37,-0.41,-1.476%,1954054793.00,,2018,190015,Health Care,Major Pharmaceuticals
RDN,Radian Group Inc. Common Stock,$24.12,-0.14,-0.577%,4475646731.00,United States,,931069,Finance,Property-Casualty Insurers
RDS/B,Royal Dutch Shell PLC,$39.52,-0.84,-2.081%,,Netherlands,,2963347,,
RDY,Dr. Reddy's Laboratories Ltd Common Stock,$62.71,-0.49,-0.775%,10400325822.00,India,,36675,Health Care,Major Pharmaceuticals
RE,Everest Re Group Ltd. Common Stock,$272.92,1.50,0.553%,10882086486.00,Bermuda,,229108,Finance,Property-Casualty Insurers
RELX,RELX PLC PLC American Depositary Shares (Each representing One Ordinary Share),$30.26,0.10,0.332%,58516487730.00,United Kingdom,2015,254505,Consumer Services,Publishing
RENN,Renren Inc. American Depositary Shares each representing fifteen Class A ordinary shares,$10.10,-0.13,-1.271%,242595496.00,China,2011,17454,Technology,EDP Services
RERE,AiHuiShou International Co. Ltd. American Depositary Shares (every three of which representing two Class A ordinary shares),$13.13,-0.10,-0.756%,2923195397.00,,2021,231665,,
RES,RPC Inc. Common Stock,$3.77,-0.18,-4.557%,813284894.00,United States,,392841,Energy,Oilfield Services/Equipment
REV,Revlon Inc. New Common Stock,$11.49,-0.11,-0.948%,616470178.00,United States,1996,58520,Consumer Non-Durables,Package Goods/Cosmetics
REVG,REV Group Inc. Common Stock,$15.86,0.02,0.126%,1026806471.00,United States,2017,238572,Capital Goods,Auto Manufacturing
REX,REX American Resources Corporation,$80.11,-1.87,-2.281%,480019120.00,United States,,7719,Basic Industries,Automotive Aftermarket
REXR,Rexford Industrial Realty Inc. Common Stock,$61.49,0.34,0.556%,8469649940.00,United States,2013,321143,Consumer Services,Real Estate Investment Trusts
REXR^A,Rexford Industrial Realty Inc. 5.875% Series A Cumulative Redeemable Preferred Stock,$25.17,0.005,0.02%,,United States,,4573,,
REXR^B,Rexford Industrial Realty Inc. 5.875% Series B Cumulative Redeemable Preferred Stock,$26.285,0.0221,0.084%,,United States,,400,,
REXR^C,Rexford Industrial Realty Inc. 5.625% Series C Cumulative Redeemable Preferred Stock par value $0.01 per share,$27.49,-0.1034,-0.375%,,United States,,781,,
REZI,Resideo Technologies Inc. Common Stock ,$31.05,-0.42,-1.335%,4476880318.00,,2018,507088,Miscellaneous,Diversified Manufacture
RF,Regions Financial Corporation Common Stock,$20.50,-0.29,-1.395%,19568055794.00,United States,,5739062,Finance,Major Banks
RF^B,Regions Financial Corporation Depositary Shares Representing 1/40th Perpetual Preferred Series B,$28.99,0.211,0.733%,,United States,,29054,,
RF^C,Regions Financial Corporation Depositary Shares each Representing a 1/40th Interest in a  Share of 5.700% Fixed-to-Floating Rate Non-Cumulative  Perpetual Preferred Stock Series C,$28.95,0.01,0.035%,,United States,,32269,,
RF^E,Regions Financial Corporation Depositary Shares Each Representing a 1/40th Interest in a Share of 4.45% Non-Cumulative Perpetual Preferred Stock Series E,$26.15,0.22,0.848%,,United States,,18582,,
RFI,Cohen & Steers Total Return Realty Fund Inc. Common Stock,$16.32,0.04,0.246%,428409776.00,United States,1993,46180,Finance,Investment Managers
RFL,Rafael Holdings Inc. Class B Common Stock,$49.52,0.55,1.123%,877221099.00,United States,2018,53502,Health Care,Major Pharmaceuticals
RFM,RiverNorth Flexible Municipal Income Fund Inc. Common Stock,$24.5199,0.0699,0.286%,149931808.00,,2020,10649,Finance,Trusts Except Educational Religious and Charitable
RFMZ,RiverNorth Flexible Municipal Income Fund II Inc. Common Stock,$21.42,0.02,0.093%,0.00,,2021,51475,Finance,Trusts Except Educational Religious and Charitable
RFP,Resolute Forest Products Inc. Common Stock,$11.36,-0.43,-3.647%,898669879.00,Canada,,402596,Basic Industries,Paper
RGA,Reinsurance Group of America Incorporated Common Stock,$118.96,0.09,0.076%,8088915626.00,United States,,321621,Finance,Life Insurance
RGR,Sturm Ruger & Company Inc. Common Stock,$80.77,-2.14,-2.581%,1421277382.00,United States,,82987,Consumer Non-Durables,Ordnance And Accessories
RGS,Regis Corporation Common Stock,$7.76,-0.01,-0.129%,277729003.00,United States,1991,94043,Consumer Services,Other Consumer Services
RGT,Royce Global Value Trust Inc. Common Stock,$15.85,0.09,0.571%,88772537.00,,2013,28997,Finance,Trusts Except Educational Religious and Charitable
RH,RH Common Stock,$722.94,-15.58,-2.11%,15203698580.00,United States,2012,406139,Consumer Services,Other Specialty Stores
RHI,Robert Half International Inc. Common Stock,$103.58,1.01,0.985%,11597856847.00,United States,,914922,Technology,Professional Services
RHP,Ryman Hospitality Properties Inc. (REIT),$79.87,-0.26,-0.324%,4398076853.00,United States,,552506,Consumer Services,Real Estate Investment Trusts
RICE,Rice Acquisition Corp. Class A Common Stock,$16.73,0.23,1.394%,496192561.00,United States,2020,43602,Finance,Finance: Consumer Services
RIG,Transocean Ltd (Switzerland) Common Stock,$3.30,-0.19,-5.444%,2148761819.00,Switzerland,,10552353,Energy,Oil & Gas Production
RIO,Rio Tinto Plc Common Stock,$79.44,0.28,0.354%,128620265640.00,Australia,2002,2362572,Basic Industries,Steel/Iron Ore
RIV,RiverNorth Opportunities Fund Inc. Common Stock,$18.66,0.06,0.323%,220828542.00,,2015,95028,Finance,Finance Companies
RJF,Raymond James Financial Inc. Common Stock,$138.94,-0.22,-0.158%,19061473292.00,United States,,308615,Finance,Investment Bankers/Brokers/Service
RKLY,Rockley Photonics Holdings Limited Ordinary Shares,$13.14,-2.19,-14.286%,0.00,,,609839,,
RKT,Rocket Companies Inc. Class A Common Stock,$19.26,1.79,10.246%,2628488701.00,United States,2020,21998036,Finance,Finance: Consumer Services
RKTA,Rocket Internet Growth Opportunities Corp. Class A Ordinary Shares,$9.73,0.02,0.206%,324738750.00,,2021,749,,
RL,Ralph Lauren Corporation Common Stock,$124.45,0.24,0.193%,9148238856.00,United States,1997,552053,Consumer Non-Durables,Department/Specialty Retail Stores
RLGY,Realogy Holdings Corp. Common Stock,$17.37,-0.10,-0.572%,2025067571.00,United States,2012,852743,Finance,Real Estate
RLI,RLI Corp. Common Stock (DE),$108.83,0.16,0.147%,4921939377.00,United States,,58600,Finance,Property-Casualty Insurers
RLJ,RLJ Lodging Trust Common Shares of Beneficial Interest $0.01 par value,$14.54,0.00,0.00%,2422634081.00,United States,2011,619620,Consumer Services,Real Estate Investment Trusts
RLJ^A,RLJ Lodging Trust $1.95 Series A Cumulative Convertible  Preferred Shares,$28.58,-0.02,-0.07%,,United States,,9173,,
RLX,RLX Technology Inc. American Depositary Shares each representing the right to receive one (1) Class A ordinary share,$5.02,0.10,2.033%,7885368661.00,,2021,10046217,Consumer Non-Durables,Farming/Seeds/Milling
RM,Regional Management Corp. Common Stock,$56.36,-0.33,-0.582%,580135291.00,United States,2012,59668,Finance,Finance: Consumer Services
RMAX,RE/MAX Holdings Inc. Class A Common Stock,$34.82,-0.24,-0.685%,657785282.00,,2013,101561,Finance,Real Estate
RMD,ResMed Inc. Common Stock,$275.10,-0.10,-0.036%,40031955583.00,United States,,297486,Health Care,Medical/Dental Instruments
RMI,RiverNorth Opportunistic Municipal Income Fund Inc. Common Stock,$23.71,-0.08,-0.336%,151110184.00,,2018,5675,Finance,Finance/Investors Services
RMM,RiverNorth Managed Duration Municipal Income Fund Inc. Common Stock,$21.55,0.09,0.419%,425386591.00,,2019,73219,Finance,Trusts Except Educational Religious and Charitable
RMO,Romeo Power Inc. Class A Common Stock,$6.57,-0.33,-4.783%,861966590.00,,2019,9073799,Capital Goods,Automotive Aftermarket
RMPL^,RiverNorth Specialty Finance Corporation 5.875% ,$25.3501,-0.0899,-0.353%,,,,918,,
RMT,Royce Micro-Cap Trust Inc. Common Stock,$11.92,-0.05,-0.418%,521676273.00,United States,,71016,Finance,Investment Managers
RNG,RingCentral Inc. Class A Common Stock,$252.76,0.66,0.262%,23130069875.00,,2013,503177,Technology,EDP Services
RNGR,Ranger Energy Services Inc. Class A Common Stock,$7.15,-0.85,-10.625%,127961505.00,United States,2017,13090,Energy,Oilfield Services/Equipment
RNP,Cohen & Steers REIT and Preferred and Income Fund Inc. Common Shares,$27.33,0.12,0.441%,1300421335.00,United States,2003,65717,Finance,Investment Managers
RNR,RenaissanceRe Holdings Ltd. Common Stock,$160.66,0.79,0.494%,7567951797.00,Bermuda,,218578,Finance,Property-Casualty Insurers
RNR^F,RenaissanceRe Holdings Ltd. Depositary Shares each Representing a 1/1000th Interest in a 5.750% Series F Preference Share,$26.99,-0.06,-0.222%,,Bermuda,,10223,,
RNR^G,RenaissanceRe Holdings Ltd. Depositary Shares each representing a 1/1000th interest in a share of 4.20% Series G Preference Shares,$25.60,0.00,0.00%,,Bermuda,,29034,,
ROG,Rogers Corporation Common Stock,$201.32,1.22,0.61%,3770550867.00,United States,,66010,Capital Goods,Industrial Machinery/Components
ROK,Rockwell Automation Inc. Common Stock,$316.53,-0.66,-0.208%,36725621785.00,United States,,317836,Capital Goods,Industrial Machinery/Components
ROL,Rollins Inc. Common Stock,$37.15,-0.04,-0.108%,18280745624.00,United States,,910844,Technology,Industrial Specialties
RONI,Rice Acquisition Corp. II Class A Ordinary Shares,$9.71,-0.04,-0.41%,335019275.00,,2021,27554,,
ROP,Roper Technologies Inc. Common Stock,$480.76,1.26,0.263%,50683567241.00,United States,1992,268289,Capital Goods,Industrial Machinery/Components
ROSS,Ross Acquisition Corp II Class A Ordinary Shares,$9.70,-0.05,-0.513%,418312500.00,,2021,56991,,
ROT,Rotor Acquisition Corp. Class A Common Stock,$9.97,0.01,0.10%,343965000.00,,2021,754518,Finance,Finance: Consumer Services
RPAI,Retail Properties of America Inc. Class A Common Stock,$12.61,0.05,0.398%,2708601128.00,United States,2012,649197,Consumer Services,Real Estate Investment Trusts
RPM,RPM International Inc. Common Stock,$87.06,0.30,0.346%,11298127835.00,United States,,265938,Basic Industries,Paints/Coatings
RPT,RPT Realty Common Stock,$12.88,0.08,0.625%,1045513418.00,United States,,132536,Consumer Services,Real Estate Investment Trusts
RPT^D,RPT Realty 7.25% ,$56.67,0.00,0.00%,,United States,,9,,
RQI,Cohen & Steers Quality Income Realty Fund Inc Common Shares,$16.52,0.11,0.67%,2217698143.00,United States,2002,448154,Finance,Trusts Except Educational Religious and Charitable
RRC,Range Resources Corporation Common Stock,$13.77,-0.75,-5.165%,3439385377.00,United States,,2822511,Energy,Oil & Gas Production
RRD,R.R. Donnelley & Sons Company Common Stock,$5.76,-0.35,-5.728%,419328000.00,United States,,322804,Consumer Services,Recreational Products/Toys
RS,Reliance Steel & Aluminum Co. Common Stock (DE),$157.14,-0.99,-0.626%,9975749419.00,United States,1994,174734,Basic Industries,Steel/Iron Ore
RSF,RiverNorth Specialty Finance Corporation,$19.72,0.00,0.00%,89851478.00,,2019,27911,Finance,Investment Managers
RSG,Republic Services Inc. Common Stock,$120.57,0.48,0.40%,38385250447.00,United States,1998,518119,Public Utilities,Environmental Services
RSI,Rush Street Interactive Inc. Class A Common Stock,$13.82,-0.22,-1.567%,3029032898.00,,2020,2070523,Consumer Services,Services-Misc. Amusement & Recreation
RSKD,Riskified Ltd. Class A Ordinary Shares,$27.60,-0.42,-1.499%,4350463745.00,,2021,211491,,
RTX,Raytheon Technologies Corporation Common Stock,$87.25,-0.73,-0.83%,131562363440.00,United States,,3050290,Capital Goods,Military/Government/Technical
RVI,Retail Value Inc. Common Stock ,$25.23,0.13,0.518%,532785695.00,United States,2018,51352,Consumer Services,Real Estate Investment Trusts
RVLV,Revolve Group Inc. Class A Common Stock,$60.09,-5.52,-8.413%,4372393687.00,,2019,975214,Consumer Services,Catalog/Specialty Distribution
RVT,Royce Value Trust Inc. Common Stock,$18.72,-0.14,-0.742%,1908928888.00,United States,1986,147854,Finance,Trusts Except Educational Religious and Charitable
RWT,Redwood Trust Inc. Common Stock,$12.47,0.21,1.713%,1409801112.00,United States,1995,946575,Consumer Services,Real Estate Investment Trusts
RXN,Rexnord Corporation Common Stock,$60.96,0.29,0.478%,7382582563.00,United States,2012,534236,Capital Goods,Industrial Machinery/Components
RY,Royal Bank Of Canada Common Stock,$104.73,0.02,0.019%,149250345239.00,Canada,,396969,Finance,Banks
RY^T,Royal Bank Of Canada 6.750% Fixed Rate/Floating Rate Noncumulative First Preferred Shares Series C-2,$28.49,-0.40,-1.385%,,Canada,,833,,
RYAM,Rayonier Advanced Materials Inc. Common Stock,$6.93,-0.16,-2.257%,441699856.00,United States,2014,215154,Basic Industries,Industrial Specialties
RYAN,Ryan Specialty Group Holdings Inc. Class A Common Stock,$29.98,0.05,0.167%,7766797901.00,,2021,218421,,
RYB,RYB Education Inc. American depositary shares each representing one Class A ordinary share,$2.86,-0.27,-8.626%,78896950.00,,2017,25723,Miscellaneous,Other Consumer Services
RYI,Ryerson Holding Corporation Common Stock,$23.31,0.16,0.691%,896842786.00,United States,2014,101405,Basic Industries,Metal Fabrications
RYN,Rayonier Inc. REIT Common Stock,$36.80,-0.13,-0.352%,5200760074.00,United States,,322504,Consumer Services,Real Estate Investment Trusts
RZA,Reinsurance Group of America Incorporated 6.20% Fixed-to-Floating Rate Subordinated Debentures due 2042,$27.16,0.07,0.258%,0.00,United States,,14793,Finance,Life Insurance
RZB,Reinsurance Group of America Incorporated 5.75% Fixed-To-Floating Rate Subordinated Debentures due 2056,$29.00,0.13,0.45%,0.00,United States,2016,19992,Finance,Life Insurance
S,SentinelOne Inc. Class A Common Stock,$50.36,0.68,1.369%,12910857610.00,,2021,579533,,
SA,Seabridge Gold Inc. Ordinary Shares (Canada),$17.22,0.35,2.075%,1299064195.00,Canada,,154657,Basic Industries,Precious Metals
SAF,Saratoga Investment Corp 6.25% Notes due 2023,$25.10,-0.0721,-0.286%,0.00,United States,2018,2580,Finance,Finance Companies
SAFE,Safehold Inc. Common Stock,$89.97,-0.97,-1.067%,4798031543.00,United States,2017,96460,Consumer Services,Real Estate
SAH,Sonic Automotive Inc. Common Stock,$51.02,-1.16,-2.223%,2128347667.00,United States,1997,126336,Consumer Services,Other Specialty Stores
SAIC,SCIENCE APPLICATIONS INTERNATIONAL CORPORATION Common Stock,$83.53,0.69,0.833%,4841330974.00,,,243360,Technology,EDP Services
SAIL,SailPoint Technologies Holdings Inc. Common Stock,$44.19,-1.35,-2.964%,4107108394.00,United States,2017,1667638,Technology,Computer Software: Prepackaged Software
SAK,Saratoga Investment Corp 7.25% Notes due 2025,$26.32,-0.18,-0.679%,0.00,United States,2020,632,Finance,Finance Companies
SAM,Boston Beer Company Inc. (The) Common Stock,$633.86,-6.14,-0.959%,7784938579.00,United States,,205258,Consumer Non-Durables,Beverages (Production/Distribution)
SAN,Banco Santander S.A. Sponsored ADR (Spain),$3.87,-0.02,-0.514%,66999478406.00,Spain,,2528405,Finance,Commercial Banks
SAND          ,Sandstorm Gold Ltd. Ordinary Shares (Canada),$6.98,0.19,2.798%,1360336507.00,Canada,,1001432,Basic Industries,Precious Metals
SAP,SAP  SE ADS,$148.30,0.55,0.372%,174931616122.00,Germany,,221434,Technology,EDP Services
SAR,Saratoga Investment Corp New,$27.05,0.07,0.259%,302512891.00,United States,,23748,Finance,Finance Companies
SAVE,Spirit Airlines Inc. Common Stock,$24.73,-0.74,-2.905%,2680777751.00,United States,,3577825,Transportation,Air Freight/Delivery Services
SB,Safe Bulkers Inc Common Stock ($0.001 par value),$3.45,0.02,0.583%,412234732.00,Monaco,2008,1201760,Transportation,Marine Transportation
SB^C,Safe Bulkers Inc Cumulative Redeemable Perpetual Preferred Series C (Marshall Islands),$25.2331,-0.0068,-0.027%,,Monaco,,675,,
SB^D,Safe Bulkers Inc Perpetual Preferred Series D (Marshall Islands),$25.20,-0.0001,0.00%,,Monaco,,2223,,
SBBA,Scorpio Tankers Inc. 7.00% Senior Notes due 2025,$24.92,0.00,0.00%,0.00,Monaco,2020,10887,Transportation,Marine Transportation
SBH,Sally Beauty Holdings Inc. (Name to be changed from Sally Holdings Inc.) Common Stock,$19.07,-0.41,-2.105%,2155547319.00,United States,,461824,Miscellaneous,Diversified Commercial Services
SBI,Western Asset Intermediate Muni Fund Inc Common Stock,$9.81,0.02,0.204%,138147510.00,United States,1992,3445,Finance,Finance/Investors Services
SBII,Sandbridge X2 Corp. Class A Common Stock,$9.65,0.00,0.00%,287301016.00,,2021,26908,Finance,Business Services
SBOW,SilverBow Resorces Inc. Common Stock,$17.02,-0.80,-4.489%,207605467.00,,,121483,Energy,Oil & Gas Production
SBR,Sabine Royalty Trust Common Stock,$38.89,-1.00,-2.507%,566990727.00,United States,,39412,Energy,Oil & Gas Production
SBS,Companhia de saneamento Basico Do Estado De Sao Paulo - Sabesp American Depositary Shares (Each repstg 250 Common Shares),$6.41,-0.17,-2.584%,4381298260.00,Brazil,2002,1727722,Public Utilities,Water Supply
SBSW,D/B/A Sibanye-Stillwater Limited ADS,$16.59,-0.01,-0.06%,12245847200.00,,,1358111,Basic Industries,Precious Metals
SC,Santander Consumer USA Holdings Inc. Common Stock,$41.99,-0.30,-0.709%,12852344591.00,,2014,435284,Finance,Finance: Consumer Services
SCCO,Southern Copper Corporation Common Stock,$67.21,1.20,1.818%,51958792089.00,United States,,907521,Basic Industries,Precious Metals
SCD,LMP Capital and Income Fund Inc. Common Stock,$14.51,0.03,0.207%,259952207.00,United States,2004,28326,Finance,Trusts Except Educational Religious and Charitable
SCE^G,SCE Trust II Trust Preferred Securities,$25.035,-0.045,-0.179%,,United States,,26745,,
SCE^H,SCE Trust III Fixed/Floating Rate Trust Preference Securities,$25.79,0.17,0.664%,,United States,,8007,,
SCE^J,Southern California Edison Company 5.375% Fixed-to-Floating Rate Trust Preference Securities,$25.12,-0.03,-0.119%,,United States,,22696,,
SCE^K,Southern California Edison Company 5.45% Fixed-to-Floating Rate Trust Preference Securities,$25.70,0.09,0.351%,,United States,,11779,,
SCE^L,SCE TRUST VI,$24.86,-0.03,-0.121%,,United States,,76875,,
SCHW,Charles Schwab Corporation (The) Common Stock,$74.01,-1.41,-1.87%,139731070650.00,United States,,3552060,Finance,Investment Bankers/Brokers/Service
SCHW^D,The Charles Schwab Corporation Depositary Shares each representing 1/40th interest in a share of 5.95% Non-Cumulative Perpetual Preferred Stock Series D,$25.75,0.01,0.039%,,United States,,43505,,
SCHW^J,The Charles Schwab Corporation Depositary Shares Each Representing a 1/40th Interest in a Share of 4.450% Non-Cumulative Perpetual Preferred Stock Series J,$26.94,0.25,0.937%,,United States,,57998,,
SCI,Service Corporation International Common Stock,$65.05,-0.08,-0.123%,10900981815.00,United States,,867423,Miscellaneous,Other Consumer Services
SCL,Stepan Company Common Stock,$114.32,0.17,0.149%,2568297230.00,United States,,48734,Consumer Non-Durables,Package Goods/Cosmetics
SCM,Stellus Capital Investment Corporation Common Stock,$13.50,0.21,1.58%,263061041.00,United States,2012,98048,Finance,Finance/Investors Services
SCS,Steelcase Inc. Common Stock,$13.93,-0.04,-0.286%,1611421731.00,United States,1998,153854,Consumer Durables,Office Equipment/Supplies/Services
SCU,Sculptor Capital Management Inc. Class A Common Stock,$28.18,-0.18,-0.635%,1637380301.00,United States,,200145,Finance,Investment Managers
SCVX,SCVX Corp. Class A Ordinary Shares,$9.91,0.01,0.101%,284912500.00,,2020,15807,Finance,Business Services
SCX,L.S. Starrett Company (The) Common Stock,$7.35,-0.07,-0.943%,52211122.00,United States,,14734,Consumer Durables,Home Furnishings
SD,SandRidge Energy Inc. Common Stock,$8.76,0.26,3.059%,319800505.00,,2016,961437,Energy,Oil & Gas Production
SDHY,PGIM Short Duration High Yield Opportunities Fund Common Shares,$19.21,-0.02,-0.104%,473969406.00,,2020,45433,Finance,Finance/Investors Services
SE,Sea Limited American Depositary Shares each representing one Class A Ordinary Share,$306.71,0.47,0.153%,160848999398.00,United States,2017,1886937,Technology,Computer Software: Prepackaged Software
SEAH,Sports Entertainment Acquisition Corp. Class A Common Stock,$9.96,-0.01,-0.10%,560250000.00,United States,2020,229823,Finance,Finance: Consumer Services
SEAS,SeaWorld Entertainment Inc. Common Stock,$52.97,1.52,2.954%,4194106386.00,United States,2013,1115986,Consumer Services,Movies/Entertainment
SEE,Sealed Air Corporation Common Stock,$60.42,0.10,0.166%,9056524487.00,United States,,670098,Basic Industries,Containers/Packaging
SEM,Select Medical Holdings Corporation Common Stock,$35.33,-0.27,-0.758%,4754574991.00,United States,2009,475184,Health Care,Hospital/Nursing Management
SEMR,SEMrush Holdings Inc. Class A Common Stock,$21.78,1.15,5.574%,2951120522.00,,2021,415307,Technology,EDP Services
SF,Stifel Financial Corporation Common Stock,$68.88,-0.49,-0.706%,7217785593.00,United States,,424028,Finance,Investment Bankers/Brokers/Service
SF^A,Stifel Financial Corporation Depositary Shares each representing a 1/1000th interest in a share of 6.25% Non-Cumulative Preferred Stock Series A,$25.25,-0.01,-0.04%,,United States,,17619,,
SF^B,Stifel Financial Corporation Depositary Shares Each Representing 1/1000th  Interest in a Share of 6.25% Non-Cumulative  Preferred Stock Series B,$27.48,-0.10,-0.363%,,United States,,8028,,
SF^C,Stifel Financial Corporation Depositary Shares Each Representing 1/1000th Interest in a Share of 6.125% Non Cumulative Preferred Stock Series C,$27.60,-0.03,-0.109%,,United States,,10565,,
SF^D,Stifel Financial Corporation Depositary Shares Each Representing 1/1000th Interest in a Share of 4.50% Non-Cumulative Preferred Stock Series D,$25.75,0.18,0.704%,,United States,,28674,,
SFB,Stifel Financial Corporation 5.20% Senior Notes due 2047,$26.19,-0.10,-0.38%,0.00,United States,2017,7330,Finance,Investment Bankers/Brokers/Service
SFBS,ServisFirst Bancshares Inc. Common Stock,$73.04,-0.63,-0.855%,3958855940.00,United States,,62181,Finance,Major Banks
SFE,Safeguard Scientifics Inc. New Common Stock,$7.79,-0.40,-4.884%,163259486.00,United States,,50668,Finance,Finance/Investors Services
SFL,SFL Corporation Ltd,$7.15,-0.01,-0.14%,831968516.00,Bermuda,,746725,Transportation,Marine Transportation
SFTW,Osprey Technology Acquisition Corp. Class A Common Stock,$10.00,0.00,0.00%,395312500.00,,2019,91067,Finance,Finance: Consumer Services
SFUN,Fang Holdings Limited American Depositary Shares (Each representing Four Class A Ordinary Shares HK$1.00 par value),$9.06,-0.69,-7.077%,81587266.00,China,2010,351,Technology,EDP Services
SGFY,Signify Health Inc. Class A Common Stock,$26.00,0.76,3.011%,4368081510.00,,2021,3344030,Technology,Retail: Computer Software & Peripheral Equipment
SGU,Star Group L.P. Common Stock,$10.55,-0.09,-0.846%,417841401.00,United States,,53553,Public Utilities,Oil Refining/Marketing
SHAK,Shake Shack Inc. Class A Common Stock,$89.44,-1.97,-2.155%,3761619491.00,United States,2015,413420,Consumer Services,Restaurants
SHG,Shinhan Financial Group Co Ltd American Depositary Shares,$33.72,-0.34,-0.998%,17419522839.00,South Korea,,73220,Finance,Major Banks
SHI,SINOPEC Shangai Petrochemical Company Ltd. Common Stock,$21.13,-0.15,-0.705%,2287071793.00,China,,10653,Basic Industries,Major Chemicals
SHLX,Shell Midstream Partners L.P. Common Units representing Limited Partner Interests,$12.59,0.07,0.559%,4951515271.00,United States,2014,1049566,Energy,Oilfield Services/Equipment
SHO,Sunstone Hotel Investors Inc. Sunstone Hotel Investors Inc. Common Shares,$11.24,0.03,0.268%,2462039465.00,United States,2004,1418133,Consumer Services,Real Estate Investment Trusts
SHO^H,Sunstone Hotel Investors Inc. 6.125% Series H Cumulative Redeemable Preferred Stock,$26.70,0.00,0.00%,,United States,,1460,,
SHO^I,Sunstone Hotel Investors Inc. 5.70% Series I Cumulative Redeemable Preferred Stock,$25.20,0.13,0.519%,,United States,,26522,,
SHOP,Shopify Inc. Class A Subordinate Voting Shares,$1498.00,-5.20,-0.346%,186933507054.00,Canada,2015,622627,Consumer Services,Other Consumer Services
SHW,Sherwin-Williams Company (The) Common Stock,$305.66,1.95,0.642%,80481027173.00,United States,,911070,Basic Industries,Paints/Coatings
