Symbol,Name,Last Sale,Net Change,% Change,Market Cap,Country,IPO Year,Volume,Sector,Industry
A,Agilent Technologies Inc. Common Stock,$159.23,1.08,0.683%,48317264717.00,United States,1999,1733161,Capital Goods,Electrical Products
AA,Alcoa Corporation Common Stock ,$45.25,0.10,0.221%,8455693559.00,,2016,5838841,Basic Industries,Aluminum
AAC,Ares Acquisition Corporation Class A Ordinary Shares,$9.71,0.02,0.206%,1213750000.00,,2021,31452,Finance,Business Services
AAIC,Arlington Asset Investment Corp Class A (new),$3.84,0.01,0.261%,124151301.00,United States,,176431,Finance,Finance/Investors Services
AAIC^B,Arlington Asset Investment Corp 7.00% ,$25.0256,0.00,0.00%,,United States,,42,,
AAIC^C,Arlington Asset Investment Corp 8.250% Seies C Fixed-to-Floating Rate Cumulative Redeemable Preferred Stock   ,$25.02,-0.01,-0.04%,,United States,,5772,,
AAIN,Arlington Asset Investment Corp 6.000% Senior Notes Due 2026,$24.89,0.05,0.201%,0.00,United States,,5737,,
AAN,Aarons Holdings Company Inc. Common Stock ,$29.24,-0.22,-0.747%,955345801.00,United States,2020,321400,Miscellaneous,Diversified Commercial Services
AAP,Advance Auto Parts Inc Advance Auto Parts Inc W/I,$206.43,-2.87,-1.371%,13508545934.00,United States,,455454,Consumer Services,Other Specialty Stores
AAQC,Accelerate Acquisition Corp. Class A Common Stock,$9.65,0.00,0.00%,482500000.00,,2021,393833,Finance,Finance: Consumer Services
AAT,American Assets Trust Inc. Common Stock,$38.24,-0.03,-0.078%,2312451766.00,United States,2011,124902,Consumer Services,Real Estate Investment Trusts
AB,AllianceBernstein Holding L.P.  Units,$50.66,0.65,1.30%,5051248112.00,United States,,241898,Finance,Investment Managers
ABB,ABB Ltd Common Stock,$37.82,0.30,0.80%,75866920000.00,Switzerland,,1148504,Consumer Durables,Electrical Products
ABBV,AbbVie Inc. Common Stock,$116.48,0.84,0.726%,205840605967.00,United States,2012,4415136,Health Care,Major Pharmaceuticals
ABC,AmerisourceBergen Corporation Common Stock,$119.57,-0.47,-0.392%,24845105460.00,United States,,854922,Health Care,Other Pharmaceuticals
ABEV,Ambev S.A. American Depositary Shares (Each representing 1 Common Share),$3.12,0.00,0.00%,49099942735.00,,2013,14535564,Consumer Non-Durables,Beverages (Production/Distribution)
ABG,Asbury Automotive Group Inc Common Stock,$195.11,-3.88,-1.95%,3773695481.00,United States,2002,101767,Consumer Services,Other Specialty Stores
ABM,ABM Industries Incorporated Common Stock,$47.53,0.17,0.359%,3190750974.00,United States,,313228,Technology,Diversified Commercial Services
ABR,Arbor Realty Trust Common Stock,$18.43,-0.28,-1.497%,2620335601.00,United States,2004,1102052,Consumer Services,Real Estate Investment Trusts
ABR^D,Arbor Realty Trust 6.375% Series D Cumulative Redeemable Preferred Stock Liquidation Preference $25.00 per Share,$25.61,0.01,0.039%,,United States,,8572,,
ABT,Abbott Laboratories Common Stock,$123.06,0.25,0.204%,218162902968.00,United States,,3475037,Health Care,Medical/Dental Instruments
AC,Associated Capital Group Inc. Common Stock,$36.55,-0.45,-1.216%,807706023.00,United States,2015,10207,Finance,Investment Bankers/Brokers/Service
ACA,Arcosa Inc. Common Stock ,$50.88,-0.29,-0.567%,2462633874.00,,2018,129514,Capital Goods,Industrial Machinery/Components
ACC,American Campus Communities Inc Common Stock,$48.74,-0.19,-0.388%,6780067966.00,United States,2004,300922,Consumer Services,Real Estate Investment Trusts
ACCO,Acco Brands Corporation Common Stock,$9.52,0.16,1.709%,910045103.00,United States,,568351,Consumer Services,Advertising
ACEL,Accel Entertainment Inc. ,$11.09,-0.30,-2.634%,1040718449.00,United States,2017,143604,Consumer Services,Recreational Products/Toys
ACH,Aluminum Corporation of China Limited American Depositary Shares,$16.04,0.14,0.881%,10921746965.00,China,2001,96799,Basic Industries,Aluminum
ACI,Albertsons Companies Inc. Class A Common Stock,$29.85,0.23,0.777%,13926089779.00,United States,2020,1705734,Consumer Services,Food Chains
ACIC,Atlas Crest Investment Corp. Class A Common Stock,$9.99,0.02,0.201%,624375000.00,United States,2020,450372,Finance,Finance: Consumer Services
ACII,Atlas Crest Investment Corp. II Class A Common Stock,$9.698,-0.01,-0.103%,418226250.00,,2021,567,Finance,Finance: Consumer Services
ACM,AECOM Common Stock,$63.71,-1.11,-1.712%,9326693443.00,United States,2007,505070,Consumer Services,Military/Government/Technical
ACN,Accenture plc Class A Ordinary Shares (Ireland),$323.45,1.69,0.525%,205111494267.00,Ireland,2001,970295,Technology,EDP Services
ACP,Aberdeen Income Credit Strategies Fund Common Shares,$11.58,0.10,0.871%,201917461.00,United States,2011,225560,Finance,Investment Managers
ACP^A,Aberdeen Income Credit Strategies Fund 5.250% Series A Perpetual Preferred Stock,$27.02,0.15,0.558%,,United States,,26403,,
ACR,ACRES Commercial Realty Corp. Common Stock,$16.80,0.02,0.119%,158316614.00,United States,,10990,Consumer Services,Real Estate Investment Trusts
ACR^C,ACRES Commercial Realty Corp. 8.625% Fixed-to-Floating Series C Cumulative Redeemable Preferred Stock ,$25.24,0.02,0.079%,,United States,,5335,,
ACR^D,ACRES Commercial Realty Corp. 7.875% Series D Cumulative Redeemable Preferred Stock,$25.3005,0.0355,0.141%,,United States,,13637,,
ACRE,Ares Commercial Real Estate Corporation Common Stock,$14.81,0.14,0.954%,696096969.00,United States,2012,244831,Consumer Services,Real Estate Investment Trusts
ACV,Virtus AllianzGI Diversified Income & Convertible Fund Common Shares of Beneficial Interest,$34.96,-0.25,-0.71%,361973043.00,United States,2015,17192,Finance,Finance/Investors Services
ADC,Agree Realty Corporation Common Stock,$74.39,0.42,0.568%,5127130790.00,United States,,240637,Consumer Services,Real Estate Investment Trusts
ADCT,ADC Therapeutics SA Common Shares,$26.78,0.28,1.057%,2096070600.00,,2020,151022,Health Care,Major Pharmaceuticals
ADEX,Adit EdTech Acquisition Corp. Common Stock,$9.69,-0.02,-0.206%,334305000.00,,2021,2204,Finance,Finance: Consumer Services
ADF,Aldel Financial Inc. Class A Common Stock,$9.69,-0.028,-0.288%,144841275.00,,2021,7907,Finance,Finance: Consumer Services
ADM,Archer-Daniels-Midland Company Common Stock,$62.40,0.58,0.938%,34904468227.00,United States,,2472408,,
ADNT,Adient plc Ordinary Shares ,$41.66,0.40,0.969%,3925111382.00,,2016,793547,Capital Goods,Auto Parts:O.E.M.
ADS,Alliance Data Systems Corporation Common Stock,$92.04,-1.15,-1.234%,4579541872.00,United States,2001,304511,Miscellaneous,Business Services
ADT,ADT Inc. Common Stock,$8.78,-0.14,-1.57%,7296794776.00,United States,2018,1405064,Consumer Services,Diversified Commercial Services
ADX,Adams Diversified Equity Fund Inc.,$20.53,0.06,0.293%,2279386794.00,United States,,114717,Finance,Investment Managers
AEB,AEGON N.V. Perp. Cap. Secs. Floating Rate (Netherlands),$25.27,0.01,0.04%,0.00,Netherlands,,18288,Finance,Life Insurance
AEE,Ameren Corporation Common Stock,$88.84,0.92,1.046%,22844953872.00,United States,,726087,Public Utilities,Power Generation
AEFC,Aegon Funding Company LLC 5.10% Subordinated Notes due 2049,$27.1621,0.1121,0.414%,0.00,,2019,43471,,
AEG,AEGON N.V. Common Stock,$4.95,0.08,1.643%,10456425421.00,Netherlands,,3083982,Finance,Life Insurance
AEL,American Equity Investment Life Holding Company Common Stock,$33.19,-0.12,-0.36%,3070500529.00,United States,2003,150350,Finance,Life Insurance
AEL^A,American Equity Investment Life Holding Company Depositary Shares each representing a 1/1000th interest in a share of 5.95% Fixed-Rate Reset Non-Cumulative Preferred Stock Series A,$27.62,0.07,0.254%,,United States,,21523,,
AEL^B,American Equity Investment Life Holding Company Depositary Shares each representing a 1/1000th interest in a share of 6.625% Fixed-Rate Reset Non-Cumulative Preferred Stock Series B,$27.86,-0.04,-0.143%,,United States,,12221,,
AEM,Agnico Eagle Mines Limited Common Stock,$59.14,1.16,2.001%,14412609968.00,Canada,,1075610,Basic Industries,Precious Metals
AENZ,Aenza S.A.A. American Depositary Shares,$1.30,-0.20,-13.333%,226698642.00,,2018,77082,Basic Industries,Military/Government/Technical
AEO,American Eagle Outfitters Inc. Common Stock,$33.25,-0.56,-1.656%,5576583667.00,United States,,2525033,Consumer Services,Clothing/Shoe/Accessory Stores
AER,AerCap Holdings N.V. Ordinary Shares,$55.66,-0.29,-0.518%,7423868906.00,Netherlands,2006,483124,Technology,Diversified Commercial Services
AES,The AES Corporation Common Stock,$24.79,-0.32,-1.274%,16519057930.00,United States,,3286050,Public Utilities,Electric Utilities: Central
AESC,The AES Corporation Corporate Units,$102.68,-0.89,-0.859%,0.00,United States,,214364,Public Utilities,Electric Utilities: Central
AEVA,Aeva Technologies Inc. Common Stock,$8.47,-0.51,-5.679%,1790640599.00,,2020,1143873,Capital Goods,Auto Parts:O.E.M.
AFB,AllianceBernstein National Municipal Income Fund Inc,$14.99,0.02,0.134%,430886591.00,United States,2002,31065,Finance,Trusts Except Educational Religious and Charitable
AFG,American Financial Group Inc. Common Stock,$134.39,-1.01,-0.746%,11389469581.00,United States,,162244,Finance,Property-Casualty Insurers
AFGB,American Financial Group Inc. 5.875% Subordinated Debentures due 2059,$28.24,0.03,0.106%,0.00,United States,2019,2609,Finance,Property-Casualty Insurers
AFGC,American Financial Group Inc. 5.125% Subordinated Debentures due 2059,$27.53,-0.07,-0.254%,27476592.00,United States,2019,7128,Finance,Real Estate
AFGD,American Financial Group Inc. 5.625% Subordinated Debentures due 2060,$28.53,0.19,0.67%,0.00,United States,2020,11279,Consumer Services,Other Consumer Services
AFGE,American Financial Group Inc. 4.500% Subordinated Debentures due 2060,$27.88,0.29,1.051%,0.00,United States,2020,2255,Consumer Services,Other Consumer Services
AFI,Armstrong Flooring Inc. Common Stock,$3.83,-0.22,-5.432%,83056851.00,,2016,215477,Capital Goods,Building Products
AFL,AFLAC Incorporated Common Stock,$57.26,-0.10,-0.174%,38406649644.00,United States,,1681571,Finance,Accident &Health Insurance
AFT,Apollo Senior Floating Rate Fund Inc. Common Stock,$15.87,0.03,0.189%,247144478.00,,2011,60138,Finance,Investment Managers
AG,First Majestic Silver Corp. Ordinary Shares (Canada),$12.75,0.27,2.163%,3206707786.00,Canada,,3024784,Basic Industries,Precious Metals
AGAC,African Gold Acquisition Corporation Class A Ordinary Shares,$9.66,-0.01,-0.103%,499905000.00,,2021,52116,Finance,Business Services
AGCB,Altimeter Growth Corp. 2 Class A Ordinary Shares,$9.87,-0.01,-0.101%,566044500.00,,2021,20220,Finance,Business Services
AGCO,AGCO Corporation Common Stock,$140.85,-2.63,-1.833%,10618083592.00,United States,,285558,Capital Goods,Industrial Machinery/Components
AGD,Aberdeen Global Dynamic Dividend Fund,$12.39,0.05,0.405%,155489321.00,United States,2006,26174,Finance,Trusts Except Educational Religious and Charitable
AGI,Alamos Gold Inc. Class A Common Shares,$7.74,0.20,2.653%,3041388100.00,Canada,2015,1958280,Basic Industries,Precious Metals
AGL,agilon health inc. Common Stock,$35.03,0.08,0.229%,13692616077.00,,2021,292118,Health Care,Managed Health Care
AGM,Federal Agricultural Mortgage Corporation Common Stock,$99.70,-0.31,-0.31%,1073337798.00,United States,,28790,Finance,Finance Companies
AGM^C,Federal Agricultural Mortgage Corporation Preferred Series C Fixed to Fltg,$27.81,-0.20,-0.714%,,United States,,688,,
AGM^D,Federal Agricultural Mortgage Corporation 5.700% Non-Cumulative Preferred Stock Series D,$27.19,0.11,0.406%,,United States,,1231,,
AGM^E,Federal Agricultural Mortgage Corporation 5.750% Non-Cumulative Preferred Stock Series E,$26.91,0.00,0.00%,,United States,,3314,,
AGM^F,Federal Agricultural Mortgage Corporation 5.250% Non-Cumulative Preferred Stock Series F,$26.76,-0.0575,-0.214%,,United States,,1839,,
AGM^G,Federal Agricultural Mortgage Corporation 4.875% Non-Cumulative Preferred Stock Series G,$25.99,0.09,0.347%,,United States,,10455,,
AGO,Assured Guaranty Ltd. Common Stock,$50.00,-0.15,-0.299%,3650304900.00,Bermuda,2004,213426,Finance,Property-Casualty Insurers
AGO^E,Assured Guaranty Ltd.,$27.18,-0.08,-0.293%,,Bermuda,,11331,,
AGO^F,Assured Guaranty Ltd.,$28.29,-0.56,-1.941%,,Bermuda,,30040,,
AGR,Avangrid Inc. Common Stock,$54.44,0.41,0.759%,21079416029.00,United States,2015,176434,Public Utilities,Electric Utilities: Central
AGRO,Adecoagro S.A. Common Shares,$9.05,-1.26,-12.221%,1059628753.00,Luxembourg,2011,1588937,,
AGS,PlayAGS Inc. Common Stock,$7.45,-0.53,-6.642%,273236252.00,United States,2018,301295,Consumer Services,Recreational Products/Toys
AGTI,Agiliti Inc. Common Stock,$18.34,-1.58,-7.932%,2389362563.00,,2021,708168,Health Care,Managed Health Care
AGX,Argan Inc. Common Stock,$45.39,-0.92,-1.987%,715774882.00,United States,,27419,Capital Goods,Oilfield Services/Equipment
AHH,Armada Hoffler Properties Inc. Common Stock,$13.50,0.35,2.662%,823378703.00,United States,2013,200392,Consumer Services,Real Estate Investment Trusts
AHH^A,Armada Hoffler Properties Inc. 6.75% Series A Cumulative Redeemable Perpetual Preferred Stock,$27.4999,0.1099,0.401%,,United States,,2792,,
AHL^C,Aspen Insurance Holdings Limited 5.95% Fixed-to-Floating Rate Perpetual Non-Cumulative Preference Shares,$27.60,0.00,0.00%,,Bermuda,,18413,,
AHL^D,Aspen Insurance Holdings Limited 5.625% Perpetual Non-Cumulative Preference Shares,$27.95,0.07,0.251%,,Bermuda,,11859,,
AHL^E,Aspen Insurance Holdings Limited Depositary Shares each representing a 1/1000th interest in a share of 5.625% Perpetual Non-Cumulative Preference Shares,$27.17,-0.02,-0.074%,,Bermuda,,6477,,
AHT,Ashford Hospitality Trust Inc Common Stock,$14.03,-0.23,-1.613%,392562220.00,United States,2003,1576515,Consumer Services,Real Estate Investment Trusts
AHT^D,Ashford Hospitality Trust Inc 8.45% Series D Cumulative Preferred Stock,$26.25,-0.195,-0.737%,,United States,,1117,,
AHT^F,Ashford Hospitality Trust Inc 7.375% Series F Cumulative Preferred Stock,$26.2501,-0.1099,-0.417%,,United States,,1063,,
AHT^G,Ashford Hospitality Trust Inc 7.375% Series G Cumulative Preferred Stock,$26.26,0.01,0.038%,,United States,,4802,,
AHT^H,Ashford Hospitality Trust Inc 7.50% Series H Cumulative Preferred Stock,$26.25,0.00,0.00%,,United States,,1401,,
AHT^I,Ashford Hospitality Trust Inc 7.50% Series I Cumulative Preferred Stock,$25.9101,-0.3899,-1.483%,,United States,,1356,,
AI,C3.ai Inc. Class A Common Stock,$49.38,-2.06,-4.005%,5106925721.00,,2020,2237477,Technology,Computer Software: Prepackaged Software
AIC,Arlington Asset Investment Corp 6.750% Notes due 2025,$25.45,-0.06,-0.235%,0.00,United States,2015,1400,Consumer Services,Real Estate Investment Trusts
AIF,Apollo Tactical Income Fund Inc. Common Stock,$15.69,0.01,0.064%,226940568.00,,2013,59493,Finance,Finance Companies
AIG,American International Group Inc. New Common Stock,$54.61,0.73,1.355%,47047920334.00,United States,,4674871,Finance,Property-Casualty Insurers
AIG^A,American International Group Inc. Depositary Shares Each Representing a 1/1000th Interest in a Share of Series A 5.85% Non-Cumulative Perpetual Preferred Stock,$27.58,0.11,0.40%,,United States,,43772,,
AIN,Albany International Corporation Common Stock,$77.16,-0.41,-0.529%,2498481000.00,United States,,76034,Basic Industries,Textiles
AIO,Virtus AllianzGI Artificial Intelligence & Technology Opportunities Fund Common Shares,$27.40,-0.03,-0.109%,940879887.00,,2019,33573,Finance,Finance/Investors Services
AIR,AAR Corp. Common Stock,$34.07,-0.60,-1.731%,1206234892.00,United States,,139756,Capital Goods,Aerospace
AIRC,Apartment Income REIT Corp. Common Stock,$50.41,0.46,0.921%,7912496008.00,,2020,219620,Consumer Services,Real Estate Investment Trusts
AIT,Applied Industrial Technologies Inc. Common Stock,$90.32,-0.96,-1.052%,3509779834.00,United States,,96130,Capital Goods,Industrial Machinery/Components
AIV,Apartment Investment and Management Company Common Stock,$6.81,0.12,1.794%,1021952055.00,United States,1994,989908,Consumer Services,Real Estate Investment Trusts
AIZ,Assurant Inc. Common Stock,$165.00,-0.94,-0.566%,9704243175.00,United States,2004,368193,Finance,Specialty Insurers
AIZN,Assurant Inc. 5.25% Subordinated Notes due 2061,$27.47,-0.02,-0.073%,0.00,United States,2020,19726,Finance,Accident &Health Insurance
AJAX,Ajax I Class A Ordinary Shares,$9.82,-0.16,-1.603%,878334512.00,United States,2020,876205,Finance,Business Services
AJG,Arthur J. Gallagher & Co. Common Stock,$140.30,-1.22,-0.862%,29007025000.00,United States,,1627807,Finance,Specialty Insurers
AJRD,Aerojet Rocketdyne Holdings Inc. Common Stock,$42.82,-1.65,-3.71%,3438161247.00,United States,,1773113,Capital Goods,Military/Government/Technical
AJX,Great Ajax Corp. Common Stock,$13.95,-0.21,-1.483%,322844097.00,United States,2015,54450,Consumer Services,Real Estate Investment Trusts
AJXA,Great Ajax Corp. 7.25% Convertible Senior Notes due 2024,$26.50,-0.0711,-0.268%,0.00,United States,2017,2642,Consumer Services,Real Estate Investment Trusts
AKO/A,Embotelladora Andina S.A.,$12.04,0.36,3.082%,,Chile,,513,,
AKO/B,Embotelladora Andina S.A.,$14.15,-0.1065,-0.747%,,Chile,,2529,,
AKR,Acadia Realty Trust Common Stock,$21.42,-0.01,-0.047%,1894255402.00,United States,,286904,Consumer Services,Real Estate Investment Trusts
AL,Air Lease Corporation Class A Common Stock,$43.50,-0.01,-0.023%,4965137981.00,United States,2011,440253,Technology,Diversified Commercial Services
AL^A,Air Lease Corporation 6.150% Fixed-to-Floating Rate Non-Cumulative Perpetual Preferred Stock Series A,$27.43,0.04,0.146%,,United States,,10888,,
ALB,Albemarle Corporation Common Stock,$235.22,-1.32,-0.558%,27508947716.00,United States,,849170,Basic Industries,Industrial Specialties
ALC,Alcon Inc. Ordinary Shares,$70.11,-0.55,-0.778%,34346889000.00,Switzerland,2019,1804728,Health Care,Ophthalmic Goods
ALCC,AltC Acquisition Corp. Class A Common Stock,$9.87,0.02,0.203%,631186500.00,,2021,1886,,
ALE,Allete Inc.,$71.10,-0.48,-0.671%,3716263261.00,United States,,94722,Public Utilities,Power Generation
ALEX,Alexander & Baldwin Inc. Common Stock REIT Holding Company,$20.54,0.09,0.44%,1489494024.00,United States,,94284,Finance,Real Estate
ALG,Alamo Group Inc. Common Stock,$152.15,-3.66,-2.349%,1814814466.00,United States,,10385,Capital Goods,Industrial Machinery/Components
ALIN^A,Altera Infrastructure L.P. 7.25% Series A ,$7.32,0.02,0.274%,,Bermuda,,32403,,
ALIN^B,Altera Infrastructure L.P. 8.50% Series B ,$7.15,0.32,4.685%,,Bermuda,,70022,,
ALIN^E,Altera Infrastructure L.P. 8.875% Series E ,$7.47,0.27,3.75%,,Bermuda,,44949,,
ALIT,Alight Inc. Class A Common Stock,$11.15,0.14,1.272%,1442531250.00,,2021,2340627,Finance,Business Services
ALK,Alaska Air Group Inc. Common Stock,$57.62,-0.95,-1.622%,7215909384.00,United States,,1099326,Transportation,Air Freight/Delivery Services
ALL,Allstate Corporation (The) Common Stock,$135.06,-0.19,-0.14%,39934730964.00,United States,,846283,Finance,Property-Casualty Insurers
ALL^B,Allstate Corporation (The) 5.100% Fixed-to-Floating Rate Subordinated Debentures due 2053,$27.24,0.15,0.554%,,United States,,25334,,
ALL^G,Allstate Corporation (The) Depositary Shares each representing a 1/1000th interest in a share of Fixed Rate Noncumulative Perpetual Preferred Stock Series G,$26.78,0.03,0.112%,,United States,,43574,,
ALL^H,Allstate Corporation (The) Depositary Shares each representing a 1/1000th interest in a share of Fixed Rate Noncumulative Perpetual Preferred Stock Series H,$27.26,0.07,0.257%,,United States,,44972,,
ALL^I,Allstate Corporation (The) Depositary Shares each representing a 1/1000th interest in a share of Fixed Rate Noncumulative Perpetual Preferred Stock Series I,$27.40,0.07,0.256%,,United States,,5875,,
ALLE,Allegion plc Ordinary Shares,$138.01,0.91,0.664%,12378966490.00,United States,2013,370330,Consumer Services,Diversified Commercial Services
ALLY,Ally Financial Inc. Common Stock,$54.49,0.20,0.368%,19645919195.00,United States,2014,2021864,Finance,Major Banks
ALLY^A,GMAC Capital Trust I Fixed Rate Floating Rate Trust Preferred Securities Series 2,$26.12,-0.03,-0.115%,,United States,,68942,,
ALP^Q,Alabama Power Company 5.00% Class A Preferred Stock Cumulative Par Value $1 Per Share (Stated Capital $25 Per Share),$26.54,-0.02,-0.075%,,United States,,9623,,
ALSN,Allison Transmission Holdings Inc. Common Stock,$38.52,-0.76,-1.935%,4073684372.00,United States,2012,212300,Capital Goods,Auto Parts:O.E.M.
ALTG,Alta Equipment Group Inc. Class A Common Stock,$12.88,-0.72,-5.294%,416840283.00,,2019,138498,Technology,Engineering & Construction
ALTG^A,Alta Equipment Group Inc. Depositary Shares (each representing 1/1000th in a share of 10% Series A Cumulative Perpetual Preferred Stock),$28.23,-0.4399,-1.534%,,,,2388,,
ALV,Autoliv Inc. Common Stock,$97.91,-0.92,-0.931%,8564385380.00,Sweden,,247441,Capital Goods,Auto Parts:O.E.M.
ALX,Alexander's Inc. Common Stock,$270.99,1.87,0.695%,1384024517.00,United States,,10850,Consumer Services,Real Estate Investment Trusts
AM,Antero Midstream Corporation Common Stock,$9.18,-0.16,-1.713%,4383080367.00,United States,2017,2561681,Public Utilities,Natural Gas Distribution
AMAM,Ambrx Biopharma Inc. American Depositary Shares (each representing seven Ordinary Shares),$16.80,-0.20,-1.176%,632846844.00,,2021,5623,,
AMBC,Ambac Financial Group Inc. Common Stock,$14.31,0.02,0.14%,661361177.00,United States,,173177,Finance,Property-Casualty Insurers
AMBP,Ardagh Metal Packaging S.A. Ordinary Shares,$12.15,0.13,1.082%,0.00,,,711643,,
AMC,AMC Entertainment Holdings Inc. Class A Common Stock,$33.47,0.40,1.21%,17181163133.00,,2013,57899665,Consumer Services,Movies/Entertainment
AMCR,Amcor plc Ordinary Shares,$12.15,0.10,0.83%,18732784318.00,,2019,2314188,Basic Industries,Containers/Packaging
AME,AMETEK Inc.,$137.24,-0.01,-0.007%,31730659152.00,United States,,393290,Consumer Durables,Metal Fabrications
AMG,Affiliated Managers Group Inc. Common Stock,$169.20,-1.28,-0.751%,6972024067.00,United States,,99190,Finance,Investment Managers
AMH,American Homes 4 Rent Common Shares of Beneficial Interest,$40.96,0.09,0.22%,13223662551.00,,2013,869123,Consumer Services,Real Estate Investment Trusts
AMH^F,American Homes 4 Rent 5.875% Series F Cumulative Redeemable Perpetual Preferred Shares,$25.94,-0.08,-0.307%,,,,29979,,
AMH^G,American Homes 4 Rent Series G cumulative redeemable perpetual preferred shares of beneficial interest,$26.23,0.05,0.191%,,,,2367,,
AMH^H,American Homes 4 Rent Series H cumulative redeemable perpetual Preferred Shares of Beneficial Interest,$27.80,-0.05,-0.18%,,,,3996,,
AMK,AssetMark Financial Holdings Inc. Common Stock,$26.36,-0.11,-0.416%,1938674142.00,United States,2019,42782,Finance,Finance/Investors Services
AMN,AMN Healthcare Services Inc AMN Healthcare Services Inc,$105.66,0.19,0.18%,4993762090.00,United States,,245438,Health Care,Assisted Living Services
AMOV,America Movil S.A.B. de C.V. Class A American Depositary Shares,$17.2371,0.4271,2.541%,56968615500.00,Mexico,,1764,Public Utilities,Telecommunications Equipment
AMP,Ameriprise Financial Inc. Common Stock,$272.17,-0.63,-0.231%,30958231673.00,United States,,300433,Finance,Investment Managers
AMPI,Advanced Merger Partners Inc. Class A Common Stock,$9.71,0.00,0.00%,348953125.00,,2021,911,Finance,Finance: Consumer Services
AMPY,Amplify Energy Corp. Common Stock,$3.80,-0.14,-3.553%,144373499.00,United States,2016,362303,Energy,Oil & Gas Production
AMR,Alpha Metallurgical Resources Inc. Common Stock,$36.53,0.94,2.641%,672163580.00,United States,2018,247263,Energy,Coal Mining
AMRC,Ameresco Inc. Class A Common Stock,$67.80,-0.24,-0.353%,3484140842.00,United States,2010,160957,Basic Industries,Water Supply
AMRX,Amneal Pharmaceuticals Inc. Class A Common Stock,$5.11,0.04,0.789%,762809926.00,,2018,522655,Health Care,Major Pharmaceuticals
AMT,American Tower Corporation (REIT) Common Stock,$282.92,2.87,1.025%,128768570655.00,United States,,807985,Finance,Trusts Except Educational Religious and Charitable
AMWL,American Well Corporation Class A Common Stock,$11.16,0.41,3.814%,2689926628.00,United States,2020,2355680,Technology,Retail: Computer Software & Peripheral Equipment
AMX,America Movil S.A.B. de C.V. American Depository Receipt Series L,$17.26,0.29,1.709%,57044300000.00,Mexico,,2281838,Public Utilities,Telecommunications Equipment
AN,AutoNation Inc. Common Stock,$115.81,-1.30,-1.11%,8291468717.00,United States,,806257,Consumer Services,Other Specialty Stores
ANAC,Arctos NorthStar Acquisition Corp. Class A Ordinary Shares,$9.70,0.01,0.103%,383453125.00,,2021,10421,Finance,Business Services
ANET,Arista Networks Inc. Common Stock,$364.07,-2.92,-0.796%,27930224576.00,,2014,332650,Technology,Computer peripheral equipment
ANF,Abercrombie & Fitch Company Common Stock,$37.54,-1.23,-3.173%,2310117562.00,United States,,1036625,Consumer Services,Clothing/Shoe/Accessory Stores
ANTM,Anthem Inc. Common Stock,$367.49,-0.14,-0.038%,89599750745.00,United States,,1144032,Health Care,Medical Specialities
AOD,Aberdeen Total Dynamic Dividend Fund Common Stock,$10.49,0.04,0.383%,1105971180.00,United States,2007,197541,Finance,Investment Managers
AOMR,Angel Oak Mortgage Inc. Common Stock,$18.36,-0.44,-2.34%,468235025.00,,2021,37225,,
AON,Aon plc Class A Ordinary Shares (Ireland),$277.24,2.24,0.815%,62586139034.00,United States,,1618120,Finance,Specialty Insurers
AOS,A.O. Smith Corporation Common Stock,$71.96,0.54,0.756%,11454473994.00,United States,,545495,Capital Goods,Building Products
AP,Ampco-Pittsburgh Corporation Common Stock,$4.83,-0.49,-9.211%,92222755.00,United States,,111006,Capital Goods,Metal Fabrications
APAM,Artisan Partners Asset Management Inc. Class A Common Stock,$52.21,-0.23,-0.439%,4126783029.00,United States,2013,427242,Finance,Investment Managers
APD,Air Products and Chemicals Inc. Common Stock,$279.74,2.13,0.767%,61924549988.00,United States,,604818,Basic Industries,Major Chemicals
APG,APi Group Corporation Common Stock,$22.26,0.05,0.225%,4490605896.00,,2020,1370722,Basic Industries,Engineering & Construction
APGB,Apollo Strategic Growth Capital II Class A Ordinary Shares,$9.72,0.03,0.31%,838350000.00,,2021,418,Finance,Business Services
