Symbol,Name,Last Sale,Net Change,% Change,Market Cap,Country,IPO Year,Volume,Sector,Industry
IAE,Voya Asia Pacific High Dividend Equity Income Fund ING Asia Pacific High Dividend Equity Income Fund Common Shares of Beneficial Interest,$8.78,0.03,0.343%,104471938.00,United States,2007,22203,Finance,Trusts Except Educational Religious and Charitable
IAG,Iamgold Corporation Ordinary Shares,$2.46,0.11,4.681%,1172682000.00,Canada,,3698034,Basic Industries,Other Metals and Minerals
IBA,Industrias Bachoco S.A.B. de C.V. Common Stock,$44.14,0.44,1.007%,2207000000.00,Mexico,1997,9048,Consumer Non-Durables,Meat/Poultry/Fish
IBER,Ibere Pharmaceuticals Class A Ordinary Shares,$9.68,-0.03,-0.309%,166980000.00,,2021,3129,,
IBM,International Business Machines Corporation Common Stock,$143.18,0.11,0.077%,128335108052.00,United States,,1910117,Technology,EDP Services
IBN,ICICI Bank Limited Common Stock,$19.36,-0.06,-0.309%,67070421097.00,India,,4766696,Finance,Commercial Banks
IBP,Installed Building Products Inc. Common Stock,$123.55,-1.30,-1.041%,3669605746.00,,2014,88412,Capital Goods,Homebuilding
ICD,Independence Contract Drilling Inc. Common Stock,$3.03,-0.15,-4.717%,21949129.00,,2014,48824,Energy,Oil & Gas Production
ICE,Intercontinental Exchange Inc. Common Stock,$116.88,-1.16,-0.983%,65821579308.00,United States,2005,1356489,Finance,Security And Commodity Exchanges
ICL,ICL Group Ltd. Ordinary Shares,$7.38,0.01,0.136%,9477035465.00,Israel,2014,79305,Basic Industries,Agricultural Chemicals
IDA,IDACORP Inc. Common Stock,$107.41,1.08,1.016%,5425964805.00,United States,,112374,Public Utilities,Electric Utilities: Central
IDE,Voya Infrastructure Industrials and Materials Fund Common Shares of Beneficial Interest,$13.31,0.02,0.15%,253412937.00,United States,2010,34333,Finance,Finance/Investors Services
IDT,IDT Corporation Class B Common Stock,$55.91,1.35,2.474%,1440307686.00,United States,,226471,Public Utilities,Telecommunications Equipment
IEX,IDEX Corporation Common Stock,$223.99,-2.51,-1.108%,17022822259.00,United States,1989,358048,Capital Goods,Fluid Controls
IFF,Internationa Flavors & Fragrances Inc. Common Stock,$156.75,0.66,0.423%,39040893449.00,United States,,555374,Basic Industries,Major Chemicals
IFFT,International Flavors & Fragrances Inc. 6.00% Tangible Equity Units,$50.96,-0.10,-0.196%,0.00,United States,2018,12145,Basic Industries,Major Chemicals
IFN,India Fund Inc. (The) Common Stock,$22.38,-0.06,-0.267%,602124389.00,United States,,116504,Finance,Finance/Investors Services
IFS,Intercorp Financial Services Inc. Common Shares,$19.12,0.74,4.026%,2206885485.00,,2019,386223,Finance,Commercial Banks
IGA,Voya Global Advantage and Premium Opportunity Fund Common Shares of Beneficial Interest,$9.96,-0.04,-0.40%,181264550.00,United States,2005,30322,Finance,Investment Managers
IGD,Voya Global Equity Dividend and Premium Opportunity Fund,$6.06,-0.03,-0.493%,575559796.00,United States,2005,177174,Finance,Trusts Except Educational Religious and Charitable
IGI,Western Asset Investment Grade Defined Opportunity Trust Inc. Common Stock,$22.03,0.15,0.686%,238889707.00,United States,2009,12910,Finance,Investment Managers
IGR,CBRE Clarion Global Real Estate Income Fund Common Stock,$9.13,0.01,0.11%,1064471210.00,United States,2004,239290,Finance,Finance Companies
IGT,International Game Technology Ordinary Shares,$19.78,-0.34,-1.69%,4058618640.00,United States,2015,1667165,Consumer Services,Movies/Entertainment
IH,iHuman Inc. American depositary shares each representing five Class A ordinary shares,$7.43,0.17,2.342%,396200857.00,United States,2020,31778,Consumer Services,Other Consumer Services
IHC,Independence Holding Company Common Stock,$43.05,-0.49,-1.125%,630440946.00,United States,,4260,Finance,Life Insurance
IHD,Voya Emerging Markets High Income Dividend Equity Fund Common Shares,$7.46,0.00,0.00%,138213785.00,United States,2011,50368,Finance,Investment Managers
IHG,Intercontinental Hotels Group American Depositary Shares (Each representing one Ordinary Share),$63.97,-0.15,-0.234%,11720347479.00,United Kingdom,,103733,Consumer Services,Hotels/Resorts
IHIT,Invesco High Income 2023 Target Term Fund Common Shares of Beneficial Interest,$9.82,-0.03,-0.305%,236436032.00,United States,2016,21429,Finance,Investment Managers
IHTA,Invesco High Income 2024 Target Term Fund Common Shares of Beneficial Interest No par value per share,$9.8968,0.0168,0.17%,86911807.00,,2017,8238,Finance,Finance/Investors Services
IIAC,Investindustrial Acquisition Corp. Class A Ordinary Shares,$9.90,-0.03,-0.302%,498093750.00,United Kingdom,2021,418541,Finance,Business Services
IIF,Morgan Stanley India Investment Fund Inc. Common Stock,$26.17,0.24,0.926%,295045945.00,United States,1994,4498,Finance,Trusts Except Educational Religious and Charitable
IIIN,Insteel Industries Inc. Common Stock,$43.37,-0.05,-0.115%,839537854.00,United States,,116582,Miscellaneous,Miscellaneous
IIM,Invesco Value Municipal Income Trust Common Stock,$16.86,-0.04,-0.237%,793372893.00,United States,,100354,Finance,Investment Managers
IIPR,Innovative Industrial Properties Inc. Common Stock,$233.30,1.02,0.439%,5582473323.00,United States,2016,130266,Consumer Services,Real Estate Investment Trusts
IIPR^A,Innovative Industrial Properties Inc. 9.00% Series A Cumulative Redeemable Preferred Stock,$36.40,0.15,0.414%,,United States,,1652,,
IMAX,Imax Corporation Common Stock,$14.60,-0.03,-0.205%,867180271.00,Canada,,881076,Miscellaneous,Industrial Machinery/Components
IMPX,AEA-Bridges Impact Corp. Class A Ordinary Shares,$9.71,0.00,0.00%,485500000.00,,2020,130746,Finance,Business Services
INFO,IHS Markit Ltd. Common Shares,$119.54,0.86,0.725%,47650113386.00,Bermuda,1996,1098088,Miscellaneous,Business Services
INFY,Infosys Limited American Depositary Shares,$23.63,0.31,1.329%,100232241907.00,India,,3685282,Technology,EDP Services
ING,ING Group N.V. Common Stock,$13.80,0.14,1.025%,53865540000.00,Netherlands,1997,4220266,Finance,Commercial Banks
INGR,Ingredion Incorporated Common Stock,$88.35,1.13,1.296%,5919897758.00,United States,,162079,Consumer Non-Durables,Farming/Seeds/Milling
INN,Summit Hotel Properties Inc. Common Stock,$9.11,0.00,0.00%,969720874.00,United States,2011,524794,Consumer Services,Real Estate Investment Trusts
INN^D,Summit Hotel Properties Inc. 6.45% Series D Cumulative Redeemable Preferred Stock,$25.00,-0.41,-1.614%,,United States,,10279,,
INN^E,Summit Hotel Properties Inc. 6.250% Series E Cumulative Redeemable Preferred Stock,$26.60,0.27,1.025%,,United States,,4071,,
INS,Intelligent Systems Corporation Common Stock,$35.22,-0.26,-0.733%,307914337.00,United States,1992,27435,Technology,Computer Software: Prepackaged Software
INSI,Insight Select Income Fund,$22.46,0.16,0.717%,240547386.00,United States,,22846,Finance,Investment Managers
INSP,Inspire Medical Systems Inc. Common Stock,$188.73,-3.29,-1.713%,5146968691.00,United States,1998,123125,Health Care,Biotechnology: Electromedical & Electrotherapeutic Apparatus
INST,Instructure Holdings Inc. Common Stock,$19.98,0.32,1.628%,2767230000.00,,2021,64676,,
INSW,International Seaways Inc. Common Stock ,$16.02,0.14,0.882%,811803776.00,,2016,211027,Transportation,Marine Transportation
INSW^A,International Seaways Inc. 8.50% Senior Notes due June 30 2023,$25.8408,0.2308,0.901%,,,,935,,
INT,World Fuel Services Corporation Common Stock,$34.15,-0.45,-1.301%,2168601974.00,United States,,223902,Energy,Oil Refining/Marketing
INVH,Invitation Homes Inc. Common Stock,$39.62,0.40,1.02%,22840349250.00,United States,2017,2883035,Consumer Services,Real Estate Investment Trusts
IO,Ion Geophysical Corporation Common Stock,$1.26,-0.03,-2.326%,36302121.00,United States,,495902,Energy,Oilfield Services/Equipment
IP,International Paper Company Common Stock,$59.22,-0.70,-1.168%,23145225841.00,United States,,1682552,Basic Industries,Containers/Packaging
IPG,Interpublic Group of Companies Inc. (The) Common Stock,$37.52,-0.06,-0.16%,14768630842.00,United States,,2318733,Technology,Advertising
IPI,Intrepid Potash Inc Common Stock,$35.90,-0.72,-1.966%,482997164.00,United States,2008,83972,Basic Industries,Major Chemicals
IPOD,Social Capital Hedosophia Holdings Corp. IV Class A Ordinary Shares,$9.99,-0.03,-0.299%,574425000.00,United States,2020,191649,Finance,Business Services
IPOF,Social Capital Hedosophia Holdings Corp. VI Class A Ordinary Shares,$9.86,-0.04,-0.404%,1417375000.00,United States,2020,518955,Finance,Business Services
IPVA,InterPrivate II Acquisition Corp. Class A Common Stock,$9.74,-0.1099,-1.116%,316976125.00,,2021,26043,Finance,Business Services
IPVF,InterPrivate III Financial Partners Inc. Class A Common Stock,$9.81,0.0046,0.047%,326047613.00,,2021,1484,Finance,Business Services
IQI,Invesco Quality Municipal Income Trust Common Stock,$13.74,-0.07,-0.507%,726623371.00,United States,,46576,Finance,Finance Companies
IQV,IQVIA Holdings Inc. Common Stock,$248.14,1.89,0.768%,47546685303.00,United States,2013,265601,Health Care,Managed Health Care
IR,Ingersoll Rand Inc. Common Stock,$52.43,0.42,0.808%,21247807386.00,United States,2017,2799123,Capital Goods,Industrial Machinery/Components
IRL,New Ireland Fund Inc (The) Common Stock,$12.88,0.06,0.468%,62509242.00,United States,1990,19763,Finance,Trusts Except Educational Religious and Charitable
IRM,Iron Mountain Incorporated (Delaware)Common Stock REIT,$46.10,-0.45,-0.967%,13344120475.00,United States,,946086,Consumer Services,Real Estate Investment Trusts
IRS,IRSA Inversiones Y Representaciones S.A. Common Stock,$4.14,-0.16,-3.721%,239596969.00,Argentina,,31385,Consumer Services,Homebuilding
IRT,Independence Realty Trust Inc. Common Stock,$20.15,0.14,0.70%,2118029025.00,United States,2013,437171,Consumer Services,Real Estate Investment Trusts
IS,ironSource Ltd. Class A Ordinary Shares,$9.68,0.00,0.00%,9805499187.00,,2021,1044373,,
ISD,PGIM High Yield Bond Fund Inc.,$16.25,0.08,0.495%,540421765.00,United States,2012,63985,Finance,Trusts Except Educational Religious and Charitable
ISOS,Isos Acquisition Corporation Class A Ordinary Shares,$9.88,-0.05,-0.504%,314723695.00,,2021,59453,,
IT,Gartner Inc. Common Stock,$304.87,0.78,0.257%,25501993803.00,United States,1993,513388,Finance,Diversified Commercial Services
ITCB,Itau CorpBanca American Depositary Shares (each representing 1500 shares of Common Stock no par value),$3.78,-0.12,-3.077%,1291265033.00,Chile,,5952,Finance,Commercial Banks
ITGR,Integer Holdings Corporation Common Stock,$91.83,0.03,0.033%,3030395326.00,United States,,128463,Health Care,Medical/Dental Instruments
ITT,ITT Inc. Common Stock ,$98.23,-0.83,-0.838%,8457603000.00,United States,2011,261806,Capital Goods,Fluid Controls
ITUB,Itau Unibanco Banco Holding SA American Depositary Shares (Each repstg 500 Preferred shares),$5.84,0.06,1.038%,57256150432.00,Brazil,,31077446,Finance,Major Banks
ITW,Illinois Tool Works Inc. Common Stock,$233.01,0.43,0.185%,73390650340.00,United States,,556365,Capital Goods,Industrial Machinery/Components
IVAN,Ivanhoe Capital Acquisition Corp. Class A Ordinary Shares,$9.86,-0.01,-0.101%,340170000.00,,2021,32616,Finance,Business Services
IVC,Invacare Corporation Common Stock,$8.07,-0.39,-4.61%,282514842.00,United States,,441536,Health Care,Industrial Specialties
IVH,Delaware Ivy High Income Opportunities Fund,$14.06,0.04,0.285%,232977490.00,,2013,24495,Finance,Investment Managers
IVR,INVESCO MORTGAGE CAPITAL INC Common Stock,$3.19,0.05,1.592%,924081624.00,United States,2009,7596999,Consumer Services,Real Estate Investment Trusts
IVR^B,Invesco Mortgage Capital Inc. Preferred Series B Cum Fxd to Fltg,$25.22,0.13,0.518%,,United States,,20981,,
IVR^C,INVESCO MORTGAGE CAPITAL INC 7.5% Fixed-to-Floating Series C Cumulative Redeemable Preferred Stock Liquation Preference $25.00 per Share,$25.49,-0.01,-0.039%,,United States,,12211,,
IVZ,Invesco Ltd Common Stock,$24.85,-0.26,-1.035%,11465585832.00,United States,,2069244,Finance,Investment Managers
IX,Orix Corp Ads Common Stock,$94.93,0.30,0.317%,22978152425.00,Japan,,10322,Finance,Diversified Financial Services
J,Jacobs Engineering Group Inc. Common Stock,$138.07,-1.49,-1.068%,17992510865.00,United States,,804501,Capital Goods,Oilfield Services/Equipment
JAX,J. Alexander's Holdings Inc. Common Stock,$13.92,0.01,0.072%,210053872.00,,2015,45407,Consumer Services,Restaurants
JBGS,JBG SMITH Properties Common Shares ,$30.51,0.48,1.598%,4025516951.00,United States,2017,320417,Consumer Services,Real Estate Investment Trusts
JBI,Janus International Group Inc. Common Stock,$14.66,-0.23,-1.545%,2028713105.00,,2021,1030535,,
JBK,Lehman ABS 3.50 3.50% Adjustable Corp Backed Tr Certs GS Cap I,$31.30,0.00,0.00%,0.00,United States,,1,Finance,Trusts Except Educational Religious and Charitable
JBL,Jabil Inc. Common Stock,$60.63,0.34,0.564%,8841650467.00,United States,1993,440202,Technology,Electrical Products
JBT,John Bean Technologies Corporation Common Stock,$141.99,-0.73,-0.511%,4510618196.00,United States,,93662,Capital Goods,Diversified Manufacture
JCE,Nuveen Core Equity Alpha Fund Nuveen Core Equity Alpha Fund Common Shares of Beneficial Interest,$17.09,0.03,0.176%,273940412.00,United States,2007,28681,Finance,Trusts Except Educational Religious and Charitable
JCI,Johnson Controls International plc Ordinary Share,$72.82,-0.18,-0.247%,51864169448.00,Switzerland,,1734425,Capital Goods,Auto Parts:O.E.M.
JCO,Nuveen Credit Opportunities 2022 Target Term Fund Common Shares of Beneficial Interest,$8.26,-0.01,-0.121%,229219064.00,United States,2017,45251,Finance,Trusts Except Educational Religious and Charitable
JDD,Nuveen Diversified Dividend and Income Fund Shares of Beneficial Interest,$10.62,-0.06,-0.562%,208879651.00,United States,2003,91637,Finance,Finance Companies
JEF,Jefferies Financial Group Inc. Common Stock,$35.09,-0.58,-1.626%,8668543068.00,United States,,674530,Finance,Investment Bankers/Brokers/Service
JELD,JELD-WEN Holding Inc. Common Stock,$29.40,0.40,1.379%,2914545892.00,United States,2017,695349,Consumer Durables,Home Furnishings
JEMD,Nuveen Emerging Markets Debt 2022 Target Term Fund Common Shares of Beneficial Interest $0.01 par value per share,$8.11,0.00,0.00%,115543105.00,,2017,5786,Finance,Investment Managers
JEQ,Aberdeen Japan Equity Fund Inc.  Common Stock,$9.19,0.08,0.878%,123224446.00,United States,1992,5524,Finance,Finance Companies
JFR,Nuveen Floating Rate Income Fund Common Stock,$9.93,0.06,0.608%,565200387.00,United States,2004,226158,Finance,Trusts Except Educational Religious and Charitable
JGH,Nuveen Global High Income Fund Common Shares of Beneficial Interest,$16.26,0.20,1.245%,376864410.00,United States,2014,38664,Finance,Investment Managers
JHAA,Nuveen Corporate Income 2023 Target Term Fund,$9.95,-0.04,-0.40%,77863317.00,,2018,22942,Finance,Finance/Investors Services
JHB,Nuveen Corporate Income November 2021 Target Term Fund,$9.395,0.0049,0.052%,525180960.00,,2016,51358,Finance,Investment Managers
JHG,Janus Henderson Group plc Ordinary Shares,$42.83,-0.29,-0.673%,7381750029.00,,2017,306547,Finance,Investment Managers
JHI,John Hancock Investors Trust Common Stock,$19.03,0.01,0.053%,165694686.00,United States,,15878,Finance,Trusts Except Educational Religious and Charitable
JHS,John Hancock Income Securities Trust Common Stock,$15.91,0.09,0.569%,185297167.00,United States,,10160,Finance,Finance Companies
JHX,James Hardie Industries plc American Depositary Shares (Ireland),$37.99,0.66,1.768%,16958580051.00,Ireland,,25553,Capital Goods,Building Materials
JILL,J. Jill Inc. Common Stock,$21.15,-0.64,-2.937%,211158195.00,,2017,17669,Consumer Services,Clothing/Shoe/Accessory Stores
JKS,JinkoSolar Holding Company Limited American Depositary Shares (each representing 4 Common Shares),$45.74,-7.62,-14.28%,2180834167.00,China,2010,3793113,Technology,Semiconductors
JLL,Jones Lang LaSalle Incorporated Common Stock,$249.59,-0.91,-0.363%,12654630065.00,United States,,323256,Finance,Real Estate
JLS,Nuveen Mortgage and Income Fund,$21.37,0.13,0.612%,117266593.00,United States,2009,8412,Finance,Investment Managers
JMIA,Jumia Technologies AG American Depositary Shares each representing two Ordinary Shares,$19.26,-1.28,-6.232%,1898893168.00,,2019,5337073,Consumer Services,Catalog/Specialty Distribution
JMM,Nuveen Multi-Market Income Fund (MA),$7.4401,-0.1099,-1.456%,70400838.00,United States,,7026,Finance,Trusts Except Educational Religious and Charitable
JMP,JMP Group LLC Common Shares,$6.80,-0.02,-0.293%,135163600.00,United States,2007,19605,Finance,Investment Bankers/Brokers/Service
JNJ,Johnson & Johnson Common Stock,$176.25,1.05,0.599%,463974968715.00,United States,,5881568,Health Care,Major Pharmaceuticals
JNPR,Juniper Networks Inc. Common Stock,$28.89,0.39,1.368%,9393636109.00,United States,1999,1754090,Technology,Computer peripheral equipment
JOBY,Joby Aviation Inc. Common Stock,$9.50,-1.81,-16.004%,819375000.00,United States,2020,4788963,Capital Goods,Aerospace
JOE,St. Joe Company (The) Common Stock,$44.91,-1.28,-2.771%,2644415276.00,United States,,82836,Consumer Services,Homebuilding
JOF,Japan Smaller Capitalization Fund Inc Common Stock,$9.08,0.07,0.777%,257271748.00,United States,1990,22391,Finance,Trusts Except Educational Religious and Charitable
JP,Jupai Holdings Limited American Depositary Shares each representing six ordinary shares,$1.41,-0.0563,-3.84%,46847495.00,,2015,82806,Consumer Services,Other Consumer Services
JPC,Nuveen Preferred & Income Opportunities Fund,$9.98,-0.03,-0.30%,1031484387.00,United States,2003,116635,Finance,Investment Managers
JPI,Nuveen Preferred and Income Term Fund Common Shares of Beneficial Interest,$25.78,0.01,0.039%,586788660.00,,2012,19437,Finance,Finance Companies
JPM,JP Morgan Chase & Co. Common Stock,$159.98,-1.81,-1.119%,478052236000.00,United States,,8979995,Finance,Major Banks
JPM^C,J P Morgan Chase & Co Depositary Shares each representing a 1/400th interest in a share of 6.00% Non-Cumulative  Preferred Stock Series EE,$28.02,0.18,0.647%,,United States,,77283,,
JPM^D,J P Morgan Chase & Co Depositary Shares each representing a 1/400th  interest in a share of 5.75% Non-Cumulative  Preferred Stock Series DD,$27.23,0.11,0.406%,,United States,,86052,,
JPM^J,J P Morgan Chase & Co Depositary Shares each representing a 1/400th interest in a share of JPMorgan Chase & Co. 4.75% Non-Cumulative Preferred Stock Series GG,$26.50,0.10,0.379%,,United States,,82094,,
JPM^K,J P Morgan Chase & Co Depositary Shares each representing a 1/400th interest in a share of 4.55% Non-Cumulative Preferred Stock Series JJ,$26.30,0.09,0.343%,,United States,,63651,,
JPM^L,J P Morgan Chase & Co Depositary Shares each representing a 1/400th interest in a share of 4.625% Non-Cumulative Preferred Stock Series LL,$26.40,0.18,0.686%,,United States,,180219,,
JPM^M,J P Morgan Chase & Co Depositary Shares each representing a 1/400th interest in a share of 4.20% Non-Cumulative Preferred Stock Series MM,$25.49,0.22,0.871%,,United States,,555602,,
JPS,Nuveen Preferred & Income Securities Fund,$10.00,0.01,0.10%,2037901470.00,United States,2002,185563,Finance,Investment Managers
JPT,Nuveen Preferred and Income 2022 Term Fund Common Shares of Beneficial Interest,$25.21,0.005,0.02%,172463425.00,United States,2017,4554,Finance,Trusts Except Educational Religious and Charitable
JQC,Nuveen Credit Strategies Income Fund Shares of Beneficial Interest,$6.49,0.01,0.154%,880104292.00,United States,2003,2079347,Finance,Finance Companies
JRI,Nuveen Real Asset Income and Growth Fund Common Shares of Beneficial Interest,$16.11,-0.10,-0.617%,442278785.00,United States,2012,46446,Finance,Finance Companies
JRO,Nuveen Floating Rate Income Opportuntiy Fund Shares of Beneficial Interest,$9.79,0.07,0.72%,396898524.00,United States,2004,268507,Finance,Investment Managers
JRS,Nuveen Real Estate Income Fund Common Shares of Beneficial Interest,$11.35,-0.02,-0.176%,327929546.00,United States,2001,54499,Finance,Finance/Investors Services
JSD,Nuveen Short Duration Credit Opportunities Fund Common Shares of Beneficial Interest,$14.67,0.08,0.548%,147956456.00,United States,2011,28743,Finance,Finance Companies
JT,Jianpu Technology Inc. American depositary shares,$2.06,0.02,0.98%,43633630.00,,2017,109664,Technology,EDP Services
JTA,Nuveen Tax-Advantaged Total Return Strategy Fund Common Share of Beneficial Interest,$11.72,0.10,0.861%,162332513.00,United States,2004,38522,Finance,Finance Companies
JTD,Nuveen Tax-Advantaged Dividend Growth Fund Common Shares of Beneficial Interest,$16.53,0.07,0.425%,239426140.00,United States,,11756,Finance,Trusts Except Educational Religious and Charitable
JW/A,John Wiley & Sons Inc.,$59.29,1.41,2.436%,,United States,,147692,,
JW/B,John Wiley & Sons Inc.,$58.2677,0.00,0.00%,,United States,,31,,
JWN,Nordstrom Inc. Common Stock,$35.83,-0.97,-2.636%,5693339561.00,United States,,2162800,Consumer Services,Clothing/Shoe/Accessory Stores
JWSM,Jaws Mustang Acquisition Corp. Class A Ordinary Shares,$9.72,-0.01,-0.103%,1257525000.00,,2021,15862,Finance,Business Services
K,Kellogg Company Common Stock,$65.57,1.16,1.801%,22351433014.00,United States,,1337459,Consumer Non-Durables,Packaged Foods
KAHC,KKR Acquisition Holdings I Corp. Class A Common Stock,$9.73,0.00,0.00%,1678425000.00,,2021,64936,Finance,Finance: Consumer Services
KAI,Kadant Inc Common Stock,$202.97,-1.40,-0.685%,2349942007.00,United States,,18369,Technology,Industrial Machinery/Components
KAMN,Kaman Corporation Common Stock,$43.48,-0.27,-0.617%,1210340846.00,United States,,59654,Capital Goods,Military/Government/Technical
KAR,KAR Auction Services Inc Common Stock,$18.86,-0.04,-0.212%,2247814446.00,United States,2009,722552,Consumer Services,Other Specialty Stores
KB,KB Financial Group Inc,$45.61,-0.15,-0.328%,17771222019.00,South Korea,,94233,Finance,Commercial Banks
KBH,KB Home Common Stock,$43.78,0.33,0.759%,4327580413.00,United States,1986,790871,Capital Goods,Homebuilding
KBR,KBR Inc. Common Stock,$39.40,0.02,0.051%,5546879080.00,United States,2006,951199,Capital Goods,Oilfield Services/Equipment
KCAC,Kensington Capital Acquisition Corp. II Class A Common Stock,$9.89,0.00,0.00%,284337500.00,,2021,31223,Finance,Business Services
KEN,Kenon Holdings Ltd. Ordinary Shares,$37.60,0.80,2.174%,2025854799.00,Singapore,2015,33721,Public Utilities,Electric Utilities: Central
KEP,Korea Electric Power Corporation Common Stock,$10.66,-0.11,-1.021%,13686674122.00,South Korea,1994,280127,Public Utilities,Electric Utilities: Central
KEX,Kirby Corporation Common Stock,$57.76,-0.68,-1.164%,3471895840.00,United States,,277726,Transportation,Marine Transportation
KEY,KeyCorp Common Stock,$20.68,-0.15,-0.72%,19777733709.00,United States,,5761119,Finance,Major Banks
KEY^I,KeyCorp Depositary Shares Each Representing a 1/40th Ownership Interest in a Share of Fixed-to-Floating Rate Perpetual Non-Cumulative Preferred Stock Series E,$29.72,0.18,0.609%,,United States,,41641,,
KEY^J,KeyCorp Depositary Shares each representing a 1/40th ownership interest in a share of Fixed Rate Perpetual Non-Cumulative Preferred Stock Series F,$27.65,0.07,0.254%,,United States,,24458,,
KEY^K,KeyCorp Depositary Shares each representing a 1/40th ownership interest in a share of Fixed Rate Perpetual Non-Cumulative Preferred Stock Series G,$28.06,-0.08,-0.284%,,United States,,47943,,
KEYS,Keysight Technologies Inc. Common Stock,$166.10,1.07,0.648%,30599936275.00,United States,2014,503494,Capital Goods,Industrial Machinery/Components
KF,Korea Fund Inc. (The) New Common Stock,$43.67,-0.59,-1.333%,219222352.00,United States,,2474,Finance,Investment Managers
KFS,Kingsway Financial Services Inc. Common Stock (DE),$5.42,0.00,0.00%,123118720.00,Canada,,4402,Consumer Services,Automotive Dealers
KFY,Korn Ferry Common Stock,$67.92,-0.64,-0.933%,3668373599.00,United States,1999,168440,Technology,Diversified Commercial Services
KGC,Kinross Gold Corporation Common Stock,$6.08,0.15,2.53%,7672555917.00,Canada,,13131551,Basic Industries,Precious Metals
KIM,Kimco Realty Corporation Common Stock,$22.04,0.07,0.319%,13520095829.00,United States,,3346565,Consumer Services,Real Estate Investment Trusts
KIM^L,Kimco Realty Corporation Class L Depositary Shares each of which represents a one-one thousandth fractional interest in a share of 5.125% Class L Cumulative Redeemable Preferred Stock liquidation preference $25000.00 per share,$26.48,0.13,0.493%,,United States,,2808,,
KIM^M,Kimco Realty Corporation Class M Depositary Shares each of which represents a one-one thousandth fractional interest in a share of 5.25% Class M Cumulative Redeemable Preferred Stock liquidation preference $25000.00 per share,$26.80,0.01,0.037%,,United States,,6720,,
KIO,KKR Income Opportunities Fund Common Shares,$16.41,0.08,0.49%,333784569.00,,2013,38925,Finance,Investment Managers
KKR,KKR & Co. Inc. Common Stock,$66.04,-0.06,-0.091%,38503365457.00,United States,,1350457,Finance,Investment Managers
KKR^B,KKR & Co. Inc. 6.50% Series B Preferred Stock,$25.39,0.00,0.00%,,United States,,19028,,
KKR^C,KKR & Co. Inc. 6.00% Series C Mandatory Convertible Preferred Stock,$85.18,0.11,0.129%,,United States,,29751,,
KKRS,KKR Group Finance Co. IX LLC 4.625% Subordinated Notes due 2061,$26.11,0.07,0.269%,0.00,,2021,71308,,
KL,Kirkland Lake Gold Ltd. Common Shares,$40.51,1.53,3.925%,10769163128.00,,,2127670,Basic Industries,Metal Mining Services
KMB,Kimberly-Clark Corporation Common Stock,$136.48,2.20,1.638%,45961289634.00,United States,,1425397,Basic Industries,Paper
KMF,Kayne Anderson NextGen Energy & Infrastructure Inc.,$7.24,-0.05,-0.686%,341709625.00,,2010,95117,Finance,Investment Managers
KMI,Kinder Morgan Inc. Common Stock,$17.21,-0.09,-0.52%,38973466253.00,United States,2011,7481965,Public Utilities,Natural Gas Distribution
KMPR,Kemper Corporation,$66.77,-0.26,-0.388%,4248366110.00,United States,,263822,Finance,Property-Casualty Insurers
KMT,Kennametal Inc. Common Stock,$36.72,-0.46,-1.237%,3070358590.00,United States,,206634,Capital Goods,Industrial Machinery/Components
