Symbol,Name,Last Sale,Net Change,% Change,Market Cap,Country,IPO Year,Volume,Sector,Industry
CRY,CryoLife Inc. Common Stock,$25.14,-0.36,-1.412%,988160684.00,United States,,87495,Health Care,Medical/Dental Instruments
CS,Credit Suisse Group American Depositary Shares,$10.39,-0.04,-0.384%,25053078510.00,Switzerland,,3605215,Finance,Investment Bankers/Brokers/Service
CSAN,Cosan S.A. ADS,$17.90,-0.35,-1.918%,8354318108.00,,2021,179503,Consumer Durables,Automotive Aftermarket
CSL,Carlisle Companies Incorporated Common Stock,$207.52,-0.05,-0.024%,10817103682.00,United States,,163045,Finance,Finance: Consumer Services
CSLT,Castlight Health Inc. Class B Common Stock,$1.86,-0.06,-3.125%,298068474.00,,2014,639726,Technology,EDP Services
CSPR,Casper Sleep Inc. Common Stock,$5.50,-0.12,-2.135%,227921892.00,,2020,770208,Consumer Durables,Home Furnishings
CSR,D/B/A Centerspace Common Stock,$96.27,1.81,1.916%,1352098672.00,United States,,44822,Consumer Services,Real Estate Investment Trusts
CSR^C,D/B/A Centerspace 6.625% Series C ,$26.36,-0.0371,-0.141%,,United States,,1261,,
CSTA,Constellation Acquisition Corp I Class A Ordinary Shares,$9.65,-0.01,-0.104%,382381250.00,,2021,9597,Finance,Business Services
CSTM,Constellium SE Ordinary Shares (France),$20.01,0.07,0.351%,2834964094.00,Netherlands,2013,1387292,Basic Industries,Metal Fabrications
CSU,Capital Senior Living Corporation Common Stock,$29.64,4.68,18.75%,64929354.00,United States,1997,85652,Health Care,Hospital/Nursing Management
CSV,Carriage Services Inc. Common Stock,$38.87,-0.61,-1.545%,692885892.00,United States,,108113,Consumer Services,Other Consumer Services
CTA^A,E.I. du Pont de Nemours and Company Preferred Stock,$92.95,-0.57,-0.609%,,United States,,102,,
CTA^B,E.I. du Pont de Nemours and Company Preferred Stock,$114.80,0.00,0.00%,,United States,,322,,
CTAC,Cerberus Telecom Acquisition Corp. Class A Ordinary Shares,$9.94,0.00,0.00%,330151762.00,United States,2020,2103,Finance,Business Services
CTBB,Qwest Corporation 6.5% Notes due 2056,$25.41,0.01,0.039%,0.00,United States,2016,83825,,
CTDD,Qwest Corporation 6.75% Notes due 2057,$26.45,0.11,0.418%,0.00,United States,2017,54162,,
CTK,CooTek (Cayman) Inc. American Depositary Shares each representing 50 Class A Ordinary Shares,$1.83,0.06,3.39%,118221078.00,,2018,89658,Technology,EDP Services
CTLT,Catalent Inc. Common Stock,$120.56,0.27,0.224%,20536377630.00,United States,2014,280261,Health Care,Major Pharmaceuticals
CTO,CTO Realty Growth Inc. Common Stock,$54.82,-0.03,-0.055%,326537523.00,United States,,14960,Consumer Services,Real Estate
CTO^A,CTO Realty Growth Inc. 6.375% Series A Cumulative Redeemable Preferred Stock,$25.5999,0.0299,0.117%,,United States,,1702,,
CTOS,Custom Truck One Source Inc. Common Stock,$7.05,-0.74,-9.499%,1738516309.00,Cayman Islands,2017,493709,Technology,Diversified Commercial Services
CTR,ClearBridge MLP and Midstream Total Return Fund Inc. Common Stock,$23.63,-0.16,-0.673%,168188864.00,United States,2012,18822,Finance,Investment Managers
CTS,CTS Corporation Common Stock,$35.73,-0.34,-0.943%,1158601489.00,United States,,108177,Capital Goods,Industrial Machinery/Components
CTT,CatchMark Timber Trust Inc. Class A Common Stock,$11.64,0.05,0.431%,569186385.00,United States,2013,187111,Consumer Services,Real Estate Investment Trusts
CTVA,Corteva Inc. Common Stock ,$45.99,-0.07,-0.152%,33765168150.00,,2019,2872724,Consumer Non-Durables,Farming/Seeds/Milling
CUBB,Customers Bancorp Inc 5.375% Subordinated Notes Due 2034,$27.40,-0.02,-0.073%,0.00,United States,2019,100,Finance,Major Banks
CUBE,CubeSmart Common Shares,$50.65,0.18,0.357%,10219655920.00,United States,,620430,Consumer Services,Real Estate Investment Trusts
CUBI,Customers Bancorp Inc Common Stock,$38.74,-0.75,-1.899%,1254167017.00,United States,,105450,Finance,Major Banks
CUBI^C,Customers Bancorp Inc Fixed-to-Floating Rate Non-Cumulative Perpetual Preferred Stock Series C,$25.26,-0.18,-0.708%,,United States,,7911,,
CUBI^D,Customers Bancorp Inc Fixed-to-Floating Rate Non-Cumulative Perpetual Preferred Stock Series D,$25.389,0.059,0.233%,,United States,,700,,
CUBI^E,Customers Bancorp Inc Fixed-to-Floating Rate Non-Cumulative Perpetual Preferred Stock Series E,$25.44,0.00,0.00%,,United States,,2679,,
CUBI^F,Customers Bancorp Inc Fixed-to-Floating Rate Non-Cumulative Perpetual Preferred Stock Series F,$25.43,0.0088,0.035%,,United States,,350,,
CUK,Carnival Plc ADS ADS,$21.12,-0.34,-1.584%,24470423282.00,United States,,1092013,Transportation,Transportation Services
CULP,Culp Inc. Common Stock,$14.45,0.26,1.832%,178062842.00,United States,,31190,Basic Industries,Textiles
CURO,CURO Group Holdings Corp. Common Stock,$16.48,0.02,0.122%,682760484.00,,2017,82764,Finance,Finance: Consumer Services
CURV,Torrid Holdings Inc. Common Stock,$29.65,-0.38,-1.265%,3310422500.00,,2021,251323,,
CUZ,Cousins Properties Incorporated Common Stock,$39.36,0.06,0.153%,5852361097.00,United States,,705641,Consumer Services,Real Estate Investment Trusts
CVA,Covanta Holding Corporation Common Stock,$19.97,-0.01,-0.05%,2656193365.00,United States,,652167,Public Utilities,Combination Utilities
CVE,Cenovus Energy Inc Common Stock,$8.22,-0.21,-2.491%,16584770640.00,Canada,,5114705,Basic Industries,Petroleum Products
CVEO,Civeo Corporation (Canada) Common Shares,$22.28,-0.01,-0.045%,318966585.00,,2014,12156,Consumer Services,Business Services
CVI,CVR Energy Inc. Common Stock,$13.12,-0.21,-1.575%,1318961459.00,United States,2007,602062,Energy,Integrated oil Companies
CVII,Churchill Capital Corp VII Class A Common Stock,$9.71,0.01,0.103%,1674975000.00,,2021,42936,Finance,Finance: Consumer Services
CVNA,Carvana Co. Class A Common Stock,$360.98,2.83,0.79%,62299045272.00,United States,2017,599741,Consumer Services,Other Specialty Stores
CVS,CVS Health Corporation Common Stock,$84.36,-0.78,-0.916%,111319325404.00,United States,,3657898,Health Care,Managed Health Care
CVX,Chevron Corporation Common Stock,$101.96,-0.68,-0.663%,197181661810.00,United States,,6569987,Energy,Integrated oil Companies
CW,Curtiss-Wright Corporation Common Stock,$120.88,-0.11,-0.091%,4942057799.00,United States,,99021,Capital Goods,Industrial Machinery/Components
CWEN,Clearway Energy Inc. Class C Common Stock,$31.17,0.37,1.201%,3626950925.00,United States,2015,391471,Public Utilities,Electric Utilities: Central
CWH,Camping World Holdings Inc. Class A Commom Stock,$38.73,-1.47,-3.657%,3391566464.00,United States,2016,999679,Capital Goods,Recreational Products/Toys
CWK,Cushman & Wakefield plc Ordinary Shares,$18.26,0.15,0.828%,4076515145.00,,2018,1933591,Finance,Real Estate
CWT,California Water Service Group Common Stock,$64.43,0.78,1.225%,3320400050.00,United States,,164713,Public Utilities,Water Supply
CX,Cemex S.A.B. de C.V. Sponsored ADR,$8.08,0.09,1.126%,11901008342.00,Mexico,,7158045,Capital Goods,Building Materials
CXE,MFS High Income Municipal Trust Common Stock,$5.40,0.05,0.935%,170227807.00,United States,1989,47602,Finance,Investment Managers
CXH,MFS Investment Grade Municipal Trust Common Stock,$10.55,-0.01,-0.095%,96113085.00,United States,1989,3847,Finance,Investment Managers
CXM,Sprinklr Inc. Class A Common Stock,$19.40,0.55,2.918%,4812929044.00,,2021,165356,,
CXP,Columbia Property Trust Inc. Common Stock,$16.37,0.06,0.368%,1880978218.00,United States,2013,534037,Consumer Services,Real Estate Investment Trusts
CXW,CoreCivic Inc. Common Stock,$10.72,-0.12,-1.107%,1289452681.00,United States,,433071,Consumer Services,Real Estate Investment Trusts
CYD,China Yuchai International Limited Common Stock,$14.99,-0.13,-0.86%,612465767.00,Singapore,1994,39542,Capital Goods,Construction/Ag Equipment/Trucks
CYH,Community Health Systems Inc. Common Stock,$12.21,-0.34,-2.709%,1612673674.00,United States,2000,1391220,Health Care,Hospital/Nursing Management
D,Dominion Energy Inc. Common Stock,$77.71,0.35,0.452%,62827549948.00,United States,,2552894,Public Utilities,Electric Utilities: Central
DAC,Danaos Corporation Common Stock,$71.07,-1.46,-2.013%,1463966666.00,Greece,2006,224650,Transportation,Marine Transportation
DAL,Delta Air Lines Inc. Common Stock,$39.90,-0.63,-1.554%,25532603632.00,United States,,7192485,Transportation,Air Freight/Delivery Services
DAN,Dana Incorporated Common Stock ,$24.05,-0.21,-0.866%,3492753049.00,United States,,305895,Capital Goods,Auto Parts:O.E.M.
DAO,Youdao Inc. American Depositary Shares each representing one Class A Ordinary Share,$9.35,-0.21,-2.197%,1159221939.00,,2019,387424,Consumer Services,Other Consumer Services
DAR,Darling Ingredients Inc. Common Stock,$78.49,1.16,1.50%,12720858288.00,United States,,1414725,Consumer Non-Durables,Farming/Seeds/Milling
DASH,DoorDash Inc. Class A Common Stock,$194.79,6.58,3.496%,63469955581.00,,2020,6912940,Capital Goods,Industrial Machinery/Components
DAVA,Endava plc American Depositary Shares (each representing one Class A Ordinary Share),$138.31,2.31,1.699%,7623279987.00,,2018,121276,Technology,EDP Services
DB,Deutsche Bank AG Common Stock,$12.96,0.11,0.856%,26745983607.00,Germany,,2809729,Finance,Commercial Banks
DBD,Diebold Nixdorf Incorporated Common Stock,$11.36,-0.21,-1.815%,890099248.00,United States,,325637,Technology,EDP Services
DBI,Designer Brands Inc. Class A Common Stock,$14.66,-0.39,-2.591%,1068246654.00,United States,,642719,Consumer Services,Clothing/Shoe/Accessory Stores
DBL,DoubleLine Opportunistic Credit Fund Common Shares of Beneficial Interest,$19.94,-0.06,-0.30%,298541959.00,United States,2012,18834,Finance,Pension Health And Welfare Funds
DBRG,DigitalBridge Group Inc.,$7.02,-0.13,-1.818%,3461576875.00,United States,2014,1231233,Consumer Services,Real Estate Investment Trusts
DBRG^G,DigitalBridge Group Inc. 7.50% Series G ,$25.13,-0.01,-0.04%,,United States,,9069,,
DBRG^H,DigitalBridge Group Inc. 7.125% Series H ,$25.32,0.06,0.238%,,United States,,3305,,
DBRG^I,DigitalBridge Group Inc. 7.15% Series I ,$25.82,0.02,0.078%,,United States,,5624,,
DBRG^J,DigitalBridge Group Inc. 7.125% Series J ,$25.81,0.06,0.233%,,United States,,5135,,
DCF,BNY Mellon Alcentra Global Credit Income 2024 Target Term Fund Inc. Common Stock,$9.53,-0.06,-0.626%,142598648.00,,2017,10776,Finance,Finance/Investors Services
DCI,Donaldson Company Inc. Common Stock,$68.31,0.00,0.00%,8578691950.00,United States,,165744,Capital Goods,Pollution Control Equipment
DCO,Ducommun Incorporated Common Stock,$54.10,-1.29,-2.329%,641063198.00,United States,,34940,Capital Goods,Military/Government/Technical
DCP,DCP Midstream  LP Common Units ,$27.10,-0.34,-1.239%,5646625701.00,United States,,443015,Public Utilities,Natural Gas Distribution
DCP^B,DCP Midstream LP 7.875% Series B Fixed-to-Floating Rate Cumulative Redeemable Perpetual Preferred Units,$25.75,0.00,0.00%,,United States,,5253,,
DCP^C,DCP Midstream LP 7.95% Series C Fixed-to-Floating Rate Cumulative Redeemable Perpetual Preferred Units,$25.00,-0.02,-0.08%,,United States,,9015,,
DCUE,Dominion Energy Inc. 2019 Series A Corporate Units,$101.97,0.16,0.157%,0.00,United States,2019,11191,Public Utilities,Electric Utilities: Central
DD,DuPont de Nemours Inc. Common Stock,$77.08,-0.92,-1.179%,40317209819.00,,2017,1640275,Basic Industries,Major Chemicals
DDD,3D Systems Corporation Common Stock,$30.14,-3.13,-9.408%,3774598934.00,United States,,4293609,Technology,Computer peripheral equipment
DDF,Delaware Investments Dividend & Income Fund Inc. Common Stock,$11.11,0.09,0.817%,84559965.00,United States,1993,12365,Finance,Finance/Investors Services
DDL,Dingdong (Cayman) Limited American Depositary Shares (each two representing three Ordinary Shares),$18.38,-3.05,-14.232%,4338623501.00,,2021,344711,,
DDS,Dillard's Inc. Common Stock,$196.21,4.73,2.47%,4148354032.00,United States,,643263,Consumer Services,Department/Specialty Retail Stores
DDT,Dillard's Capital Trust I,$26.50,0.1472,0.559%,0.00,United States,,9146,Consumer Services,Department/Specialty Retail Stores
DE,Deere & Company Common Stock,$384.00,-1.62,-0.42%,119785763328.00,United States,,814268,Capital Goods,Industrial Machinery/Components
DEA,Easterly Government Properties Inc. Common Stock,$21.99,0.35,1.617%,1845956927.00,United States,2015,903652,Consumer Services,Real Estate Investment Trusts
DECK,Deckers Outdoor Corporation Common Stock,$434.45,4.28,0.995%,12018097812.00,United States,1993,261777,Consumer Non-Durables,Shoe Manufacturing
DEH,D8 Holdings Corp. Class A Ordinary Shares,$9.94,-0.01,-0.101%,428662500.00,Hong Kong,2020,814500,Finance,Business Services
DEI,Douglas Emmett Inc. Common Stock,$32.10,0.26,0.817%,5632666351.00,United States,2006,572144,Consumer Services,Real Estate Investment Trusts
DELL,Dell Technologies Inc. Class C Common Stock ,$100.03,-0.48,-0.478%,76391926605.00,,2018,1293454,Technology,Computer Manufacturing
DEN,Denbury Inc. Common Stock,$67.99,-1.55,-2.229%,3406975501.00,,2020,421598,Energy,Oil & Gas Production
DEO,Diageo plc Common Stock,$201.52,2.46,1.236%,117672054139.00,United Kingdom,,260870,Consumer Non-Durables,Beverages (Production/Distribution)
DESP,Despegar.com Corp. Ordinary Shares,$12.65,-0.60,-4.528%,886756499.00,,2017,953554,Transportation,Other Consumer Services
DEX,Delaware Enhanced Global Dividend Common Shares of Beneficial Interest,$10.60,0.08,0.76%,119823799.00,United States,2007,19572,Finance,Finance Companies
DFIN,Donnelley Financial Solutions Inc. Common Stock ,$32.31,-0.54,-1.644%,1085836774.00,,2016,84097,Finance,Investment Managers
DFNS,LGL Systems Acquisition Corp. Common Stock,$10.00,-0.01,-0.10%,215625000.00,United States,2020,213758,Finance,Finance: Consumer Services
DFP,Flaherty & Crumrine Dynamic Preferred and Income Fund Inc. Common Stock,$30.02,-0.04,-0.133%,581572537.00,,2013,12045,Finance,Investment Managers
DFS,Discover Financial Services Common Stock,$135.38,1.12,0.834%,40542037407.00,United States,,1304250,Finance,Finance: Consumer Services
DG,Dollar General Corporation Common Stock,$236.76,0.48,0.203%,55924011812.00,United States,2009,1306642,Consumer Services,Department/Specialty Retail Stores
DGX,Quest Diagnostics Incorporated Common Stock,$148.22,0.15,0.101%,18109632099.00,United States,,945086,Health Care,Medical Specialities
DHF,BNY Mellon High Yield Strategies Fund Common Stock,$3.36,0.00,0.00%,244297832.00,United States,1998,127081,Finance,Finance Companies
DHI,D.R. Horton Inc. Common Stock,$97.78,0.40,0.411%,35024251952.00,United States,,1284858,Capital Goods,Homebuilding
DHR,Danaher Corporation Common Stock,$315.26,1.49,0.475%,225063976862.00,United States,,1373385,Capital Goods,Industrial Machinery/Components
DHR^A,Danaher Corporation 4.75% Mandatory Convertible Preferred Stock Series A,$2109.70,2.65,0.126%,,United States,,2384,,
DHR^B,Danaher Corporation 5.00% Mandatory Convertible Preferred Stock Series B,$1673.89,0.00,0.00%,,United States,,3353,,
DHT,DHT Holdings Inc.,$5.40,-0.16,-2.878%,906758188.00,Jersey,2005,2093627,Transportation,Marine Transportation
DHX,DHI Group Inc. Common Stock,$3.88,0.10,2.646%,194930288.00,United States,2007,173486,Technology,Diversified Commercial Services
DIAX,Nuveen Dow 30SM Dynamic Overwrite Fund Common Shares of Beneficial Interest,$17.62,-0.09,-0.508%,640785025.00,,2014,57455,Finance,Finance Companies
DIDI,DiDi Global Inc. American Depositary Shares (each four representing one Class A Ordinary Share),$8.32,-0.49,-5.562%,40129369080.00,,2021,21330321,,
DIN,Dine Brands Global Inc. Common Stock,$77.36,0.60,0.782%,1328736752.00,United States,,176130,Consumer Services,Restaurants
DIS,Walt Disney Company (The) Common Stock,$181.08,1.79,0.998%,329010057063.00,United States,,32481546,Consumer Services,Services-Misc. Amusement & Recreation
DK,Delek US Holdings Inc. Common Stock,$16.32,-0.61,-3.603%,1208694729.00,United States,2017,421617,Energy,Integrated oil Companies
DKL,Delek Logistics Partners L.P. Common Units representing Limited Partner Interests,$39.82,-0.74,-1.824%,1730315702.00,United States,2012,16280,Energy,Oil & Gas Production
DKS,Dick's Sporting Goods Inc Common Stock,$109.02,-0.46,-0.42%,9732147481.00,United States,2002,1125618,Consumer Services,Other Specialty Stores
DLB,Dolby Laboratories Common Stock,$99.60,1.26,1.281%,10098192610.00,United States,2005,539775,Miscellaneous,Multi-Sector Companies
DLNG,Dynagas LNG Partners LP Common Units,$3.06,-0.04,-1.29%,112595169.00,Greece,,33849,Transportation,Other Transportation
DLNG^A,Dynagas LNG Partners LP 9.00% Series A Cumulative Redeemable Preferred Units,$25.05,-0.05,-0.199%,,Greece,,5360,,
DLNG^B,Dynagas LNG Partners LP 8.75% Series B Fixed to Floating Rate Cumulative Redeemable Perpetual Preferred Units liquidation preference $25.00 per Uni,$24.8534,-0.4772,-1.884%,,Greece,,11100,,
DLR,Digital Realty Trust Inc. Common Stock,$159.10,1.58,1.003%,44960614395.00,United States,2004,477233,Consumer Services,Real Estate Investment Trusts
DLR^J,Digital Realty Trust Inc. 5.250% Series J Cumulative Redeemable Preferred Stock,$26.24,0.01,0.038%,,United States,,3666,,
DLR^K,Digital Realty Trust Inc. 5.850% Series K Cumulative Redeemable Preferred Stock par value $0.01 per share,$28.02,0.04,0.143%,,United States,,21167,,
DLR^L,Digital Realty Trust Inc. 5.200% Series L Cumulative Redeemable Preferred Stock,$27.59,-0.04,-0.145%,,United States,,9926,,
DLX,Deluxe Corporation Common Stock,$42.07,-0.34,-0.802%,1789858474.00,United States,,88079,Technology,Advertising
DLY,DoubleLine Yield Opportunities Fund Common Shares of Beneficial Interest,$19.88,0.08,0.404%,953162087.00,,2020,37935,Finance,Investment Managers
DM,Desktop Metal Inc. Class A Common Stock,$8.37,-0.41,-4.67%,2140851121.00,,2019,6594376,Technology,Industrial Machinery/Components
DMB,BNY Mellon Municipal Bond Infrastructure Fund Inc. Common Stock,$15.22,0.07,0.462%,279933043.00,,2013,28868,Finance,Trusts Except Educational Religious and Charitable
DMO,Western Asset Mortgage Opportunity Fund Inc. Common Stock,$15.85,0.01,0.063%,174779757.00,United States,2010,19927,Finance,Trusts Except Educational Religious and Charitable
DMS,Digital Media Solutions Inc. Class A Ordinary Shares,$7.22,0.01,0.139%,448847393.00,United States,2018,197352,Technology,Advertising
DMYI,dMY Technology Group Inc. III Class A Common Stock,$10.02,0.01,0.10%,375750000.00,United States,2021,629106,Finance,Finance: Consumer Services
DMYQ,dMY Technology Group Inc. IV Class A Common Stock,$9.875,-0.005,-0.051%,425859375.00,,2021,588912,Finance,Finance: Consumer Services
DNB,Dun & Bradstreet Holdings Inc. Common Stock,$19.23,0.17,0.892%,8289752704.00,United States,2020,1224572,Technology,EDP Services
DNMR,Danimer Scientific Inc. Common Stock,$15.47,-0.39,-2.459%,1323249887.00,,2020,2225229,Consumer Non-Durables,Plastic Products
DNOW,NOW Inc. Common Stock,$7.48,-0.23,-2.983%,826980056.00,,2014,359914,Energy,Metal Fabrications
DNP,DNP Select Income Fund Inc. Common Stock,$10.76,0.04,0.373%,3668906096.00,United States,1987,395501,Finance,Investment Managers
DNZ,D and Z Media Acquisition Corp. Class A Common Stock,$9.65,0.001,0.01%,346796875.00,,2021,11704,Finance,Finance: Consumer Services
DOC,Physicians Realty Trust Common Shares of Beneficial Interest,$18.71,0.31,1.685%,4067663790.00,United States,2013,1270826,Consumer Services,Real Estate Investment Trusts
DOCN,DigitalOcean Holdings Inc. Common Stock,$53.47,-1.51,-2.746%,5739477553.00,,2021,1835619,Technology,Retail: Computer Software & Peripheral Equipment
DOCS,Doximity Inc. Class A Common Stock,$76.01,-3.53,-4.438%,13545553595.00,,2021,5478724,,
DOLE,Dole plc Ordinary Shares,$15.78,0.52,3.408%,1469096602.00,,2021,622670,Consumer Non-Durables,Farming/Seeds/Milling
DOMA,Doma Holdings Inc. Common Stock,$8.46,0.15,1.805%,2730782132.00,,2021,623904,Finance,Finance: Consumer Services
DOOR,Masonite International Corporation Ordinary Shares (Canada),$122.77,-0.87,-0.704%,2957696758.00,Canada,,126883,Consumer Durables,Home Furnishings
DOV,Dover Corporation Common Stock,$171.64,-0.42,-0.244%,24709454540.00,United States,,741607,Capital Goods,Industrial Machinery/Components
DOW,Dow Inc. Common Stock ,$63.69,-0.32,-0.50%,47498205178.00,,2019,2384480,Basic Industries,Major Chemicals
DPG,Duff & Phelps Utility and Infrastructure Fund Inc.,$14.62,-0.03,-0.205%,554533764.00,United States,2011,57335,Finance,Trusts Except Educational Religious and Charitable
DPZ,Domino's Pizza Inc Common Stock,$517.02,0.54,0.105%,19054364171.00,United States,2004,462037,Consumer Services,Restaurants
DQ,DAQO New Energy Corp. American Depositary Shares each representing five ordinary shares,$51.50,-5.11,-9.027%,3785949370.00,China,2010,1946519,Technology,Semiconductors
DRD,DRDGOLD Limited American Depositary Shares,$9.56,0.03,0.315%,817488783.00,South Africa,,207513,Basic Industries,Precious Metals
DRE,Duke Realty Corporation Common Stock,$50.99,0.22,0.433%,19291577557.00,United States,,842744,Consumer Services,Real Estate Investment Trusts
DRH,Diamondrock Hospitality Company Common Stock,$8.70,-0.07,-0.798%,1832392608.00,United States,2005,626044,Consumer Services,Real Estate Investment Trusts
DRH^A,Diamondrock Hospitality Company 8.250% Series A Cumulative Redeemable Preferred Stock,$28.37,-0.54,-1.868%,,United States,,1696,,
DRI,Darden Restaurants Inc. Common Stock,$141.99,0.03,0.021%,18566999039.00,United States,,976879,Consumer Services,Restaurants
DRQ,Dril-Quip Inc. Common Stock,$26.16,-0.70,-2.606%,926877838.00,United States,1997,244326,Energy,Metal Fabrications
DRUA,Dominion Energy Inc. 2016 Series A 5.25% Enhanced Junior Subordinated Notes due 2076,$25.08,0.01,0.04%,0.00,United States,2016,107151,Public Utilities,Electric Utilities: Central
DS,Drive Shack Inc.,$2.60,-0.07,-2.622%,239422089.00,United States,,1099807,Consumer Services,Movies/Entertainment
DS^B,Drive Shack Inc. Preferred Series B,$25.82,-0.32,-1.224%,,United States,,3529,,
DS^C,Drive Shack Inc. Preferred Series C,$25.45,-0.05,-0.196%,,United States,,1201,,
DS^D,Drive Shack Inc. Pfd Ser D,$25.705,0.405,1.601%,,United States,,1720,,
DSL,DoubleLine Income Solutions Fund Common Shares of Beneficial Interests,$18.00,0.05,0.279%,1835942904.00,,2013,165640,Finance,Trusts Except Educational Religious and Charitable
DSM,BNY Mellon Strategic Municipal Bond Fund Inc. Common Stock,$8.35,0.01,0.12%,412669617.00,United States,1989,84749,Finance,Investment Managers
DSU,Blackrock Debt Strategies Fund Inc. Common Stock,$11.37,-0.05,-0.438%,529748846.00,United States,1998,124480,Finance,Finance Companies
DSX,Diana Shipping inc. common stock,$4.30,-0.08,-1.826%,393600509.00,Greece,2005,586331,Transportation,Marine Transportation
DSX^B,Diana Shipping Inc. Perpetual Preferred Shares Series B (Marshall Islands),$25.86,-0.05,-0.193%,,Greece,,6084,,
DT,Dynatrace Inc. Common Stock,$63.65,0.21,0.331%,18094825987.00,United States,2019,1178963,Technology,EDP Services
DTB,DTE Energy Company 2020 Series G 4.375% Junior Subordinated Debentures due 2080,$26.42,-0.02,-0.076%,0.00,United States,2020,11266,Public Utilities,Electric Utilities: Central
DTE,DTE Energy Company Common Stock,$120.30,0.35,0.292%,23308311946.00,United States,,988131,Public Utilities,Electric Utilities: Central
DTF,DTF Tax-Free Income Inc. Common Stock,$14.95,-0.02,-0.134%,105092027.00,United States,1991,5261,Finance,Investment Managers
DTLA^,Brookfield DTLA Inc. 7.625% Series A Cumulative Redeemable Preferred Stock,$14.14,-0.05,-0.352%,,,,4416,,
DTM,DT Midstream Inc. Common Stock ,$42.35,-0.54,-1.259%,4096619935.00,,2021,247685,,
DTP,DTE Energy Company 6.25% Corporate Units,$51.81,0.02,0.039%,0.00,United States,,9902,Public Utilities,Electric Utilities: Central
DTW,DTE Energy Company 2017 Series E 5.25% Junior Subordinated Debentures due 2077,$26.53,0.09,0.34%,0.00,United States,2017,16391,Public Utilities,Electric Utilities: Central
DTY,DTE Energy Company 2016 Series F 6.00% Junior Subordinated Debentures due 2076,$25.88,0.08,0.31%,0.00,United States,2016,10719,,
DUK,Duke Energy Corporation (Holding Company) Common Stock,$106.00,0.31,0.293%,81549785388.00,United States,,2010729,Public Utilities,Power Generation
DUK^A,Duke Energy Corporation Depositary Shares each representing a 1/1000th interest in a share of 5.75% Series A Cumulative Redeemable Perpetual Preferred Stock,$28.1614,-0.0386,-0.137%,,United States,,47611,,
DUKB,Duke Energy Corporation 5.625% Junior Subordinated Debentures due 2078,$27.34,0.05,0.183%,0.00,United States,2018,20207,Public Utilities,Power Generation
DUKH,Duke Energy Corporation 5.125% Junior Subordinated Debentures due 2073,$26.59,0.07,0.264%,0.00,United States,,13718,Public Utilities,Power Generation
DV,DoubleVerify Holdings Inc. Common Stock,$33.06,-0.74,-2.189%,5218560804.00,,2021,197926,Technology,Computer Software: Prepackaged Software
DVA,DaVita Inc. Common Stock,$130.28,-0.99,-0.754%,13644928694.00,United States,,327969,Health Care,Medical/Nursing Services
DVD,Dover Motorsports Inc. Common Stock,$2.66,-0.07,-2.564%,96945272.00,United States,1996,49784,Consumer Services,Services-Misc. Amusement & Recreation
DVN,Devon Energy Corporation Common Stock,$28.01,-0.46,-1.616%,18962770000.00,United States,,5643271,Energy,Oil & Gas Production
DWIN,Delwinds Insurance Acquisition Corp. Class A Common Stock,$9.82,0.01,0.102%,253245525.00,,2021,76196,Finance,Finance: Consumer Services
DX,Dynex Capital Inc. Common Stock,$17.69,0.09,0.511%,611924254.00,United States,,320954,Consumer Services,Real Estate Investment Trusts
DX^C,Dynex Capital Inc. 6.900% Series C Fixed-to-Floating Rate Cumulative Redeemable Preferred Stock,$26.13,0.00,0.00%,,United States,,4423,,
DXC,DXC Technology Company Common Stock ,$41.23,-0.35,-0.842%,10386011898.00,,,1085986,Technology,EDP Services
DY,Dycom Industries Inc. Common Stock,$74.10,-0.90,-1.20%,2280701003.00,United States,,250551,Basic Industries,Water Supply
DYFN,Angel Oak Dynamic Financial Strategies Income Term Trust Common Shares of Beneficial Interest,$20.58,-0.045,-0.218%,83451900.00,,2020,20228,Finance,Finance/Investors Services
E,ENI S.p.A. Common Stock,$24.69,-0.01,-0.04%,44103125429.00,Italy,,88567,Energy,Oil & Gas Production
